Sheet: Custeio
B2: SESAI :: PLANO DISTRITAL DE SAÚDE INDÍGENA 2016-2019
B3: PREVISÃO ORÇAMENTÁRIA 2016-2019
B4: %= "DSEI #{current_dsei.name}" %> | E4: =R[1]C[1]/SUM(R[6]C,R[13]C) -> 7.9119972340381871E-7 | F4: Saldo para Custeio de Edificações e Contratos | J4: Saldo para Custeio de Edificações e Contratos | N4: Saldo para Custeio de Edificações e Contratos | R4: Saldo para Custeio de Edificações e Contratos
F5: =(R[5]C[-1]+R[12]C[-1])-(R[5]C+R[12]C) -> 15.037000000476837 | I5: 1.0169999999999999 | J5: =(R[5]C[-1]+R[12]C[-1])-(R[5]C+R[12]C) -> 0.29262899607419968 | M5: 1.02 | N5: =(R[5]C[-1]+R[12]C[-1])-(R[5]C+R[12]C) -> 0.29848157986998558 | Q5: 1.0249999999999999 | R5: =(R[5]C[-1]+R[12]C[-1])-(R[5]C+R[12]C) -> 0.30594361945986748
E6: PREVISÃO ORÇAMENTÁRIA 2016 | I6: PREVISÃO ORÇAMENTÁRIA 2017 | M6: PREVISÃO ORÇAMENTÁRIA 2018 | Q6: PREVISÃO ORÇAMENTÁRIA 2019 | U6: PREVISÃO ORÇAMENTÁRIA 2016-2019
B7: DESPESA | E7: DOTAÇÃO ORÇAMENTÁRIA INICIAL (PLOA 2016) (em R$) | F7: PREVISÃO DO DSEI (em R$) | G7: DOTAÇÃO ORÇAMENTÁRIA ATUALIZADA (em R$) | I7: PREVISÃO ORÇAMENTÁRIA (em R$) 1,7% SUPERIOR A 2016 | J7: PREVISÃO DO DSEI (em R$) | K7: PREVISÃO ATUALIZADA (em R$) | M7: PREVISÃO ORÇAMENTÁRIA (em R$) 2% SUPERIOR A 2017 | N7: PREVISÃO DO DSEI (em R$) | O7: PREVISÃO ATUALIZADA (em R$) | Q7: PREVISÃO ORÇAMENTÁRIA (em R$) 2,5% SUPERIOR A 2018 | R7: PREVISÃO DO DSEI (em R$) | S7: PREVISÃO ATUALIZADA (em R$) | U7: PREVISÃO ORÇAMENTÁRIA (em R$) | V7: PREVISÃO DO DSEI (em R$) | W7: PREVISÃO ATUALIZADA (em R$)
B8: MATERIAL MÉDICO HOSPITALAR (MMH) | E8: 640468.86916743603 | F8: 0 | G8: Valor/Data | I8: =RC[-4]*R5C -> 651356.83994328242 | J8: 0 | M8: =RC[-4]*R5C -> 664383.97674214805 | N8: 0 | Q8: =RC[-4]*R5C -> 680993.57616070169 | R8: 0 | U8: =RC[-12]+RC[-8]+RC[-4]+RC[-16] -> 2637203.2620135681 | V8: =RC[-12]+RC[-8]+RC[-4]+RC[-16] -> 0
B9: CUSTEIO DE SANEAMENTO | E9: 2941522.4 | F9: 0 | I9: =RC[-4]*R5C -> 2991528.2807999998 | J9: 0 | M9: =RC[-4]*R5C -> 3051358.8464159998 | N9: 0 | Q9: =RC[-4]*R5C -> 3127642.8175763995 | R9: 0 | U9: =RC[-12]+RC[-8]+RC[-4]+RC[-16] -> 12112052.3447924 | V9: =RC[-12]+RC[-8]+RC[-4]+RC[-16] -> 0
B10: CUSTEIO DE EDIFICAÇÕES (considerar as ND 3.3.90.37.04, 3.3.90.39.16 e ND 3.3.90.30 | E10: 100000 | F10: 0 | I10: =RC[-4]*R5C -> 101699.99999999999 | M10: =RC[-4]*R5C -> 103733.99999999999 | N10: =RC[-4]*R5C[-1] -> 0 | Q10: =RC[-4]*R5C -> 106327.34999999998 | R10: =RC[-4]*R5C[-1] -> 0 | U10: =RC[-12]+RC[-8]+RC[-4]+RC[-16] -> 411761.35 | V10: =RC[-12]+RC[-8]+RC[-4]+RC[-16] -> 0
B11: SATELITAL | E11: 0 | F11: 0 | I11: =RC[-4]*R5C -> 0 | J11: 0 | M11: =RC[-4]*R5C -> 0 | N11: 0 | Q11: =RC[-4]*R5C -> 0 | R11: 0 | U11: =RC[-12]+RC[-8]+RC[-4]+RC[-16] -> 0 | V11: =RC[-12]+RC[-8]+RC[-4]+RC[-16] -> 0
B12: PASSAGENS E DIÁRIAS (SCDP) | E12: 474600 | I12: =RC[-4]*R5C -> 482668.19999999995 | J12: =RC[-4]*R5C9 -> 0 | M12: =RC[-4]*R5C -> 492321.56399999995 | N12: =RC[-4]*R5C13 -> 0 | Q12: =RC[-4]*R5C -> 504629.60309999989 | R12: =RC[-4]*R5C17 -> 0 | U12: =RC[-12]+RC[-8]+RC[-4]+RC[-16] -> 1954219.3670999999 | V12: =RC[-12]+RC[-8]+RC[-4]+RC[-16] -> 0
B13: CONVÊNIOS PARA CONTRATAÇÃO DE RECURSOS HUMANOS | E13: 42565139.423806965 | F13: 0 | I13: =RC[-4]*R5C -> 43288746.794011682 | J13: 0 | M13: =RC[-4]*R5C -> 44154521.729891919 | N13: 0 | Q13: =RC[-4]*R5C -> 45258384.773139216 | R13: 0 | U13: =RC[-12]+RC[-8]+RC[-4]+RC[-16] -> 175266792.72084978 | V13: =RC[-12]+RC[-8]+RC[-4]+RC[-16] -> 0
B14: MEDICAMENTOS | E14: 1131933.7122238115 | F14: 0 | I14: =RC[-4]*R5C -> 1151176.5853316162 | J14: 0 | M14: =RC[-4]*R5C -> 1174200.1170382486 | N14: 0 | Q14: =RC[-4]*R5C -> 1203555.1199642047 | R14: 0 | U14: =RC[-12]+RC[-8]+RC[-4]+RC[-16] -> 4660865.5345578808 | V14: =RC[-12]+RC[-8]+RC[-4]+RC[-16] -> 0
B15: SERVIDORES PÚBLICO FEDERAIS | E15: 571509.01 | F15: 0 | I15: =RC[-4] -> 571509.01 | J15: 0 | M15: =RC[-4] -> 571509.01 | N15: 0 | Q15: =RC[-4] -> 571509.01 | R15: 0 | U15: =RC[-12]+RC[-8]+RC[-4]+RC[-16] -> 2286036.04 | V15: =RC[-12]+RC[-8]+RC[-4]+RC[-16] -> 0
B16: COMBUSTÍVEL | E16: 1897245 | I16: =RC[-4]*R5C -> 1929498.1649999998 | J16: =RC[-4]*R5C9 -> 0 | M16: =RC[-4]*R5C -> 1968088.1282999997 | N16: =RC[-4]*R5C13 -> 0 | Q16: =RC[-4]*R5C -> 2017290.3315074996 | R16: =RC[-4]*R5C17 -> 0 | U16: =RC[-12]+RC[-8]+RC[-4]+RC[-16] -> 7812121.6248074993 | V16: =RC[-12]+RC[-8]+RC[-4]+RC[-16] -> 0
B17: CONTRATOS | E17: 18905315.037 | F17: =R[1]C+R[5]C+R[7]C+R[11]C+R[20]C -> 19005300 | I17: =RC[-4]*R5C -> 19226705.392628998 | J17: =R[1]C+R[5]C+R[7]C+R[11]C+R[20]C -> 19328405.100000001 | M17: =RC[-4]*R5C -> 19611239.500481579 | N17: =R[1]C+R[5]C+R[7]C+R[11]C+R[20]C -> 19714973.202 | Q17: =RC[-4]*R5C -> 20101520.487993617 | R17: =R[1]C+R[5]C+R[7]C+R[11]C+R[20]C -> 20207847.532049999 | U17: =RC[-12]+RC[-8]+RC[-4]+RC[-16] -> 77844780.418104187 | V17: =RC[-12]+RC[-8]+RC[-4]+RC[-16] -> 78256525.83405
B18: ALIMENTAÇÃO | F18: =SUM(R[1]C:R[3]C) -> 180000 | J18: =SUM(R[1]C:R[3]C) -> 183059.99999999997 | N18: =SUM(R[1]C:R[3]C) -> 186721.19999999998 | R18: =SUM(R[1]C:R[3]C) -> 191389.22999999995 | U18: =RC[-12]+RC[-8]+RC[-4]+RC[-16] -> 0 | V18: =RC[-12]+RC[-8]+RC[-4]+RC[-16] -> 741170.42999999993
C19: 3.3.90.30.07 - Generos de Alimentação | F19: 0 | J19: =RC[-4]*R5C[-1] -> 0 | N19: =RC[-4]*R5C[-1] -> 0 | R19: =RC[-4]*R5C[-1] -> 0 | U19: =RC[-12]+RC[-8]+RC[-4]+RC[-16] -> 0 | V19: =RC[-12]+RC[-8]+RC[-4]+RC[-16] -> 0
C20: 3.3.90.36.23 - Fornecimento de Alimentação (Outros Serviços de Terceiros - Pessoa Física) | J20: =RC[-4]*R5C[-1] -> 0 | N20: =RC[-4]*R5C[-1] -> 0 | R20: =RC[-4]*R5C[-1] -> 0 | U20: =RC[-12]+RC[-8]+RC[-4]+RC[-16] -> 0 | V20: =RC[-12]+RC[-8]+RC[-4]+RC[-16] -> 0
C21: 3.3.90.39.41 - Fornecimento de Alimentação (Outros Serviço de Terceiros - Pessoa Jurídica) | F21: 180000 | J21: =RC[-4]*R5C[-1] -> 183059.99999999997 | N21: =RC[-4]*R5C[-1] -> 186721.19999999998 | R21: =RC[-4]*R5C[-1] -> 191389.22999999995 | U21: =RC[-12]+RC[-8]+RC[-4]+RC[-16] -> 0 | V21: =RC[-12]+RC[-8]+RC[-4]+RC[-16] -> 741170.42999999993
B22: HORAS VÔO | F22: =R[1]C -> 0 | J22: =R[1]C -> 0 | N22: =R[1]C -> 0 | R22: =R[1]C -> 0 | U22: =RC[-12]+RC[-8]+RC[-4]+RC[-16] -> 0 | V22: =RC[-12]+RC[-8]+RC[-4]+RC[-16] -> 0
C23: 3.3.90.33.03 - Horas Vôo | F23: 0 | J23: =RC[-4]*R5C[-1] -> 0 | N23: =RC[-4]*R5C[-1] -> 0 | R23: =RC[-4]*R5C[-1] -> 0 | U23: =RC[-12]+RC[-8]+RC[-4]+RC[-16] -> 0 | V23: =RC[-12]+RC[-8]+RC[-4]+RC[-16] -> 0
B24: LOCAÇÃO DE VEÍCULOS | F24: =SUM(R[1]C:R[3]C) -> 0 | J24: =SUM(R[1]C:R[3]C) -> 0 | N24: =SUM(R[1]C:R[3]C) -> 0 | R24: =SUM(R[1]C:R[3]C) -> 0 | U24: =RC[-12]+RC[-8]+RC[-4]+RC[-16] -> 0 | V24: =RC[-12]+RC[-8]+RC[-4]+RC[-16] -> 0
C25: 3.3.90.33.03 - Locação de Veículos | F25: 0 | J25: =RC[-4]*R5C[-1] -> 0 | N25: =RC[-4]*R5C[-1] -> 0 | R25: =RC[-4]*R5C[-1] -> 0 | U25: =RC[-12]+RC[-8]+RC[-4]+RC[-16] -> 0 | V25: =RC[-12]+RC[-8]+RC[-4]+RC[-16] -> 0
C26: 3.3.90.33.05 - Locomoção Urbana | F26: 0 | J26: =RC[-4]*R5C[-1] -> 0 | N26: =RC[-4]*R5C[-1] -> 0 | R26: =RC[-4]*R5C[-1] -> 0 | U26: =RC[-12]+RC[-8]+RC[-4]+RC[-16] -> 0 | V26: =RC[-12]+RC[-8]+RC[-4]+RC[-16] -> 0
C27: 3.3.90.33.09 - Transporte de Servidores | F27: 0 | J27: =RC[-4]*R5C[-1] -> 0 | N27: =RC[-4]*R5C[-1] -> 0 | R27: =RC[-4]*R5C[-1] -> 0 | U27: =RC[-12]+RC[-8]+RC[-4]+RC[-16] -> 0 | V27: =RC[-12]+RC[-8]+RC[-4]+RC[-16] -> 0
B28: LOCAÇÃO DE MÃO DE OBRA | F28: =SUM(R[1]C:R[8]C) -> 11308000 | J28: =SUM(R[1]C:R[8]C) -> 11220561 | N28: =SUM(R[1]C:R[8]C) -> 11444972.220000001 | R28: =SUM(R[1]C:R[8]C) -> 11731096.5255 | U28: =RC[-12]+RC[-8]+RC[-4]+RC[-16] -> 0 | V28: =RC[-12]+RC[-8]+RC[-4]+RC[-16] -> 45704629.745499998
C29: 3.3.90.37.01 - Secretária e Recepcionista | F29: 125000 | J29: =200000*R5C[-1] -> 203399.99999999997 | N29: =RC[-4]*R5C[-1] -> 207467.99999999997 | R29: =RC[-4]*R5C[-1] -> 212654.69999999995 | U29: =RC[-12]+RC[-8]+RC[-4]+RC[-16] -> 0 | V29: =RC[-12]+RC[-8]+RC[-4]+RC[-16] -> 748522.7
C30: 3.3.90.37.01 - Motorista | F30: 8450000 | J30: =RC[-4]*R5C[-1] -> 8593650 | N30: =RC[-4]*R5C[-1] -> 8765523 | R30: =RC[-4]*R5C[-1] -> 8984661.0749999993 | U30: =RC[-12]+RC[-8]+RC[-4]+RC[-16] -> 0 | V30: =RC[-12]+RC[-8]+RC[-4]+RC[-16] -> 34793834.075000003
C31: 3.3.90.37.01 - Barqueiro | F31: 0 | J31: =RC[-4]*R5C[-1] -> 0 | N31: =RC[-4]*R5C[-1] -> 0 | R31: =RC[-4]*R5C[-1] -> 0 | U31: =RC[-12]+RC[-8]+RC[-4]+RC[-16] -> 0 | V31: =RC[-12]+RC[-8]+RC[-4]+RC[-16] -> 0
C32: 3.3.90.37.01 - Artíficie | F32: 108000 | J32: =RC[-4]*R5C[-1] -> 109835.99999999999 | N32: =RC[-4]*R5C[-1] -> 112032.71999999999 | R32: =RC[-4]*R5C[-1] -> 114833.53799999997 | U32: =RC[-12]+RC[-8]+RC[-4]+RC[-16] -> 0 | V32: =RC[-12]+RC[-8]+RC[-4]+RC[-16] -> 444702.25799999991
C33: 3.3.90.37.02 - Limpeza e Conservação | F33: 2275000 | J33: =RC[-4]*R5C[-1] -> 2313675 | N33: =RC[-4]*R5C[-1] -> 2359948.5 | R33: =RC[-4]*R5C[-1] -> 2418947.2124999999 | U33: =RC[-12]+RC[-8]+RC[-4]+RC[-16] -> 0 | V33: =RC[-12]+RC[-8]+RC[-4]+RC[-16] -> 9367570.7125000004
C34: 3.3.90.37.03 - Vigilância Ostensiva | F34: 350000 | N34: =RC[-4]*R5C[-1] -> 0 | R34: =RC[-4]*R5C[-1] -> 0 | U34: =RC[-12]+RC[-8]+RC[-4]+RC[-16] -> 0 | V34: =RC[-12]+RC[-8]+RC[-4]+RC[-16] -> 350000
C35: 3.3.90.37.05 - Serviço de Copa e Cozinha | F35: 0 | J35: =RC[-4]*R5C[-1] -> 0 | N35: =RC[-4]*R5C[-1] -> 0 | R35: =RC[-4]*R5C[-1] -> 0 | U35: =RC[-12]+RC[-8]+RC[-4]+RC[-16] -> 0 | V35: =RC[-12]+RC[-8]+RC[-4]+RC[-16] -> 0
C36: 3.3.90.37.06 - Manutenção e Conservação de Bens Movéis | F36: 0 | J36: =RC[-4]*R5C[-1] -> 0 | N36: =RC[-4]*R5C[-1] -> 0 | R36: =RC[-4]*R5C[-1] -> 0 | U36: =RC[-12]+RC[-8]+RC[-4]+RC[-16] -> 0 | V36: =RC[-12]+RC[-8]+RC[-4]+RC[-16] -> 0
B37: OUTROS CONTRATOS | F37: =SUM(R[1]C:R[59]C) -> 7517300 | J37: =SUM(R[1]C:R[59]C) -> 7924784.0999999996 | N37: =SUM(R[1]C:R[59]C) -> 8083279.7819999987 | R37: =SUM(R[1]C:R[59]C) -> 8285361.7765499977 | U37: =RC[-12]+RC[-8]+RC[-4]+RC[-16] -> 0 | V37: =RC[-12]+RC[-8]+RC[-4]+RC[-16] -> 31810725.658549998
C38: 3.3.90.30.03 - Combustíveis e Outros Materiais Lubrificantes | F38: 0 | J38: =RC[-4]*R5C[-1] -> 0 | N38: =RC[-4]*R5C[-1] -> 0 | R38: =RC[-4]*R5C[-1] -> 0 | U38: =RC[-12]+RC[-8]+RC[-4]+RC[-16] -> 0 | V38: =RC[-12]+RC[-8]+RC[-4]+RC[-16] -> 0
C39: 3.3.90.30.04 - Gás e Outros Materiais Engarrafados | F39: 0 | J39: =RC[-4]*R5C[-1] -> 0 | N39: =RC[-4]*R5C[-1] -> 0 | R39: =RC[-4]*R5C[-1] -> 0 | U39: =RC[-12]+RC[-8]+RC[-4]+RC[-16] -> 0 | V39: =RC[-12]+RC[-8]+RC[-4]+RC[-16] -> 0
C40: 3.3.90.30.14 - Material Educativo e Esportivo | F40: 0 | J40: =RC[-4]*R5C[-1] -> 0 | N40: =RC[-4]*R5C[-1] -> 0 | R40: =RC[-4]*R5C[-1] -> 0 | U40: =RC[-12]+RC[-8]+RC[-4]+RC[-16] -> 0 | V40: =RC[-12]+RC[-8]+RC[-4]+RC[-16] -> 0
C41: 3.3.90.30.16 - Material de Expediente | F41: 30000 | J41: =RC[-4]*R5C[-1] -> 30509.999999999996 | N41: =RC[-4]*R5C[-1] -> 31120.199999999997 | R41: =RC[-4]*R5C[-1] -> 31898.204999999994 | U41: =RC[-12]+RC[-8]+RC[-4]+RC[-16] -> 0 | V41: =RC[-12]+RC[-8]+RC[-4]+RC[-16] -> 123528.405
C42: 3.3.90.30.17 - Material de Processamento de Dados | F42: 3000 | J42: =RC[-4]*R5C[-1] -> 3050.9999999999995 | N42: =RC[-4]*R5C[-1] -> 3112.0199999999995 | R42: =RC[-4]*R5C[-1] -> 3189.8204999999994 | U42: =RC[-12]+RC[-8]+RC[-4]+RC[-16] -> 0 | V42: =RC[-12]+RC[-8]+RC[-4]+RC[-16] -> 12352.840499999998
C43: 3.3.90.30.19 - Material de Acondicionamento e Embalagem | F43: 0 | J43: =RC[-4]*R5C[-1] -> 0 | N43: =RC[-4]*R5C[-1] -> 0 | R43: =RC[-4]*R5C[-1] -> 0 | U43: =RC[-12]+RC[-8]+RC[-4]+RC[-16] -> 0 | V43: =RC[-12]+RC[-8]+RC[-4]+RC[-16] -> 0
C44: 3.3.90.30.20 - Material de Cama, Mesa e Banho | F44: 0 | J44: =RC[-4]*R5C[-1] -> 0 | N44: =RC[-4]*R5C[-1] -> 0 | R44: =RC[-4]*R5C[-1] -> 0 | U44: =RC[-12]+RC[-8]+RC[-4]+RC[-16] -> 0 | V44: =RC[-12]+RC[-8]+RC[-4]+RC[-16] -> 0
C45: 3.3.90.30.21 - Material de Copa e Cozinha | F45: 0 | J45: =RC[-4]*R5C[-1] -> 0 | N45: =RC[-4]*R5C[-1] -> 0 | R45: =RC[-4]*R5C[-1] -> 0 | U45: =RC[-12]+RC[-8]+RC[-4]+RC[-16] -> 0 | V45: =RC[-12]+RC[-8]+RC[-4]+RC[-16] -> 0
C46: 3.3.90.30.22 - Material de Limpeza e Prod. de Higienização | F46: 0 | J46: =RC[-4]*R5C[-1] -> 0 | N46: =RC[-4]*R5C[-1] -> 0 | R46: =RC[-4]*R5C[-1] -> 0 | U46: =RC[-12]+RC[-8]+RC[-4]+RC[-16] -> 0 | V46: =RC[-12]+RC[-8]+RC[-4]+RC[-16] -> 0
C47: 3.3.90.30.23 - Uniformes, Tercidos e Aviamentos | F47: 0 | J47: =RC[-4]*R5C[-1] -> 0 | N47: =RC[-4]*R5C[-1] -> 0 | R47: =RC[-4]*R5C[-1] -> 0 | U47: =RC[-12]+RC[-8]+RC[-4]+RC[-16] -> 0 | V47: =RC[-12]+RC[-8]+RC[-4]+RC[-16] -> 0
C48: 3.3.90.30.25 - Material p/Manutenção de Bens Móveis | F48: 0 | J48: =RC[-4]*R5C[-1] -> 0 | N48: =RC[-4]*R5C[-1] -> 0 | R48: =RC[-4]*R5C[-1] -> 0 | U48: =RC[-12]+RC[-8]+RC[-4]+RC[-16] -> 0 | V48: =RC[-12]+RC[-8]+RC[-4]+RC[-16] -> 0
C49: 3.3.90.30.26 - Material Elétrico e Eletrônico | F49: 0 | J49: =RC[-4]*R5C[-1] -> 0 | N49: =RC[-4]*R5C[-1] -> 0 | R49: =RC[-4]*R5C[-1] -> 0 | U49: =RC[-12]+RC[-8]+RC[-4]+RC[-16] -> 0 | V49: =RC[-12]+RC[-8]+RC[-4]+RC[-16] -> 0
C50: 3.3.90.30.28 - Material de Proteção e Segurança | F50: 0 | J50: =RC[-4]*R5C[-1] -> 0 | N50: =RC[-4]*R5C[-1] -> 0 | R50: =RC[-4]*R5C[-1] -> 0 | U50: =RC[-12]+RC[-8]+RC[-4]+RC[-16] -> 0 | V50: =RC[-12]+RC[-8]+RC[-4]+RC[-16] -> 0
C51: 3.3.90.30.34 - Sobressal. Máq. e Motores, Navios e Embarcações | F51: 0 | J51: =RC[-4]*R5C[-1] -> 0 | N51: =RC[-4]*R5C[-1] -> 0 | R51: =RC[-4]*R5C[-1] -> 0 | U51: =RC[-12]+RC[-8]+RC[-4]+RC[-16] -> 0 | V51: =RC[-12]+RC[-8]+RC[-4]+RC[-16] -> 0
C52: 3.3.90.30.39 - Material p/ Manutenção de Veículos | F52: 350000 | J52: =RC[-4]*R5C[-1] -> 355949.99999999994 | N52: =RC[-4]*R5C[-1] -> 363068.99999999994 | R52: =RC[-4]*R5C[-1] -> 372145.72499999992 | U52: =RC[-12]+RC[-8]+RC[-4]+RC[-16] -> 0 | V52: =RC[-12]+RC[-8]+RC[-4]+RC[-16] -> 1441164.7249999999
C53: 3.3.90.30.42 - Ferramentas | F53: 0 | J53: =RC[-4]*R5C[-1] -> 0 | N53: =RC[-4]*R5C[-1] -> 0 | R53: =RC[-4]*R5C[-1] -> 0 | U53: =RC[-12]+RC[-8]+RC[-4]+RC[-16] -> 0 | V53: =RC[-12]+RC[-8]+RC[-4]+RC[-16] -> 0
C54: 3.3.90.30.44 - Material de Sinalização Visual e Outros | F54: 0 | J54: =RC[-4]*R5C[-1] -> 0 | N54: =RC[-4]*R5C[-1] -> 0 | R54: =RC[-4]*R5C[-1] -> 0 | U54: =RC[-12]+RC[-8]+RC[-4]+RC[-16] -> 0 | V54: =RC[-12]+RC[-8]+RC[-4]+RC[-16] -> 0
C55: 3.3.90.33.03 - Embarcação Fluvial | F55: 0 | J55: =RC[-4]*R5C[-1] -> 0 | N55: =RC[-4]*R5C[-1] -> 0 | R55: =RC[-4]*R5C[-1] -> 0 | U55: =RC[-12]+RC[-8]+RC[-4]+RC[-16] -> 0 | V55: =RC[-12]+RC[-8]+RC[-4]+RC[-16] -> 0
C56: 3.3.90.33.08 - Pedágios | F56: 0 | J56: =RC[-4]*R5C[-1] -> 0 | N56: =RC[-4]*R5C[-1] -> 0 | R56: =RC[-4]*R5C[-1] -> 0 | U56: =RC[-12]+RC[-8]+RC[-4]+RC[-16] -> 0 | V56: =RC[-12]+RC[-8]+RC[-4]+RC[-16] -> 0
C57: 3.3.90.36.06 - Serviços Técnicos Profissionais | F57: 0 | J57: =RC[-4]*R5C[-1] -> 0 | N57: =RC[-4]*R5C[-1] -> 0 | R57: =RC[-4]*R5C[-1] -> 0 | U57: =RC[-12]+RC[-8]+RC[-4]+RC[-16] -> 0 | V57: =RC[-12]+RC[-8]+RC[-4]+RC[-16] -> 0
C58: 3.3.90.36.15 - Locação de Imóveis | F58: 253000 | J58: =RC[-4]*R5C[-1] -> 257300.99999999997 | N58: =RC[-4]*R5C[-1] -> 262447.01999999996 | R58: =RC[-4]*R5C[-1] -> 269008.19549999991 | U58: =RC[-12]+RC[-8]+RC[-4]+RC[-16] -> 0 | V58: =RC[-12]+RC[-8]+RC[-4]+RC[-16] -> 1041756.2154999998
C59: 3.3.90.36.16 - Locação de Bens Móveis e Intangíveis | F59: 0 | J59: =RC[-4]*R5C[-1] -> 0 | N59: =RC[-4]*R5C[-1] -> 0 | R59: =RC[-4]*R5C[-1] -> 0 | U59: =RC[-12]+RC[-8]+RC[-4]+RC[-16] -> 0 | V59: =RC[-12]+RC[-8]+RC[-4]+RC[-16] -> 0
C60: 3.3.90.36.17 - Tributos a Conta do Locatário ou Cessionário | F60: 0 | J60: =RC[-4]*R5C[-1] -> 0 | N60: =RC[-4]*R5C[-1] -> 0 | R60: =RC[-4]*R5C[-1] -> 0 | U60: =RC[-12]+RC[-8]+RC[-4]+RC[-16] -> 0 | V60: =RC[-12]+RC[-8]+RC[-4]+RC[-16] -> 0
C61: 3.3.90.36.35 - Serviço de Apoio Administrativo, Técnico e Operacional | F61: 0 | J61: =RC[-4]*R5C[-1] -> 0 | N61: =RC[-4]*R5C[-1] -> 0 | R61: =RC[-4]*R5C[-1] -> 0 | U61: =RC[-12]+RC[-8]+RC[-4]+RC[-16] -> 0 | V61: =RC[-12]+RC[-8]+RC[-4]+RC[-16] -> 0
C62: 3.3.90.36.46 - Diárias a Conselheiros | F62: 0 | J62: =RC[-4]*R5C[-1] -> 0 | N62: =RC[-4]*R5C[-1] -> 0 | R62: =RC[-4]*R5C[-1] -> 0 | U62: =RC[-12]+RC[-8]+RC[-4]+RC[-16] -> 0 | V62: =RC[-12]+RC[-8]+RC[-4]+RC[-16] -> 0
C63: 3.3.90.36.80 - Hospedagens | F63: 0 | J63: =RC[-4]*R5C[-1] -> 0 | N63: =RC[-4]*R5C[-1] -> 0 | R63: =RC[-4]*R5C[-1] -> 0 | U63: =RC[-12]+RC[-8]+RC[-4]+RC[-16] -> 0 | V63: =RC[-12]+RC[-8]+RC[-4]+RC[-16] -> 0
C64: 3.3.90.39.01 - Assinatura de Periódicos e Anuidade | F64: 0 | J64: =RC[-4]*R5C[-1] -> 0 | N64: =RC[-4]*R5C[-1] -> 0 | R64: =RC[-4]*R5C[-1] -> 0 | U64: =RC[-12]+RC[-8]+RC[-4]+RC[-16] -> 0 | V64: =RC[-12]+RC[-8]+RC[-4]+RC[-16] -> 0
C65: 3.3.90.39.05 - Serviços Técnicos Profissionais | F65: 0 | J65: =RC[-4]*R5C[-1] -> 0 | N65: =RC[-4]*R5C[-1] -> 0 | R65: =RC[-4]*R5C[-1] -> 0 | U65: =RC[-12]+RC[-8]+RC[-4]+RC[-16] -> 0 | V65: =RC[-12]+RC[-8]+RC[-4]+RC[-16] -> 0
C66: 3.3.90.39.08 - Manutenção de Software | F66: 0 | J66: =RC[-4]*R5C[-1] -> 0 | N66: =RC[-4]*R5C[-1] -> 0 | R66: =RC[-4]*R5C[-1] -> 0 | U66: =RC[-12]+RC[-8]+RC[-4]+RC[-16] -> 0 | V66: =RC[-12]+RC[-8]+RC[-4]+RC[-16] -> 0
C67: 3.3.90.39.09 - Armazenagem | F67: 0 | J67: =RC[-4]*R5C[-1] -> 0 | N67: =RC[-4]*R5C[-1] -> 0 | R67: =RC[-4]*R5C[-1] -> 0 | U67: =RC[-12]+RC[-8]+RC[-4]+RC[-16] -> 0 | V67: =RC[-12]+RC[-8]+RC[-4]+RC[-16] -> 0
C68: 3.3.90.39.10 - Locação de Imóveis | F68: 545000 | J68: =RC[-4]*R5C[-1] -> 554265 | N68: =RC[-4]*R5C[-1] -> 565350.30000000005 | R68: =RC[-4]*R5C[-1] -> 579484.0575 | U68: =RC[-12]+RC[-8]+RC[-4]+RC[-16] -> 0 | V68: =RC[-12]+RC[-8]+RC[-4]+RC[-16] -> 2244099.3574999999
C69: 3.3.90.39.11 - Locação de Software | F69: 0 | J69: =RC[-4]*R5C[-1] -> 0 | N69: =RC[-4]*R5C[-1] -> 0 | R69: =RC[-4]*R5C[-1] -> 0 | U69: =RC[-12]+RC[-8]+RC[-4]+RC[-16] -> 0 | V69: =RC[-12]+RC[-8]+RC[-4]+RC[-16] -> 0
C70: 3.3.90.39.12 - Locação de Máquinas e Equipamentos | F70: 40000 | J70: =RC[-4]*R5C[-1] -> 40679.999999999993 | N70: =RC[-4]*R5C[-1] -> 41493.599999999991 | R70: =RC[-4]*R5C[-1] -> 42530.939999999988 | U70: =RC[-12]+RC[-8]+RC[-4]+RC[-16] -> 0 | V70: =RC[-12]+RC[-8]+RC[-4]+RC[-16] -> 164704.53999999998
C71: 3.3.90.39.14 - Locação de Bens Mov. Out. Naturezas e Intangíveis | F71: 180000 | J71: =RC[-4]*2*R5C[-1] -> 366119.99999999994 | N71: =RC[-4]*R5C[-1] -> 373442.39999999997 | R71: =RC[-4]*R5C[-1] -> 382778.4599999999 | U71: =RC[-12]+RC[-8]+RC[-4]+RC[-16] -> 0 | V71: =RC[-12]+RC[-8]+RC[-4]+RC[-16] -> 1302340.8599999999
C72: 3.3.90.39.15 - Tributos a Conta do Locatário ou Cessionário | F72: 0 | J72: =RC[-4]*R5C[-1] -> 0 | N72: =RC[-4]*R5C[-1] -> 0 | R72: =RC[-4]*R5C[-1] -> 0 | U72: =RC[-12]+RC[-8]+RC[-4]+RC[-16] -> 0 | V72: =RC[-12]+RC[-8]+RC[-4]+RC[-16] -> 0
C73: 3.3.90.39.17 - Manut. e Conserv. de Maquinas e Equipamentos | F73: 358000 | J73: =RC[-4]*R5C[-1] -> 364085.99999999994 | N73: =RC[-4]*R5C[-1] -> 371367.72 | R73: =RC[-4]*R5C[-1] -> 380651.91299999994 | U73: =RC[-12]+RC[-8]+RC[-4]+RC[-16] -> 0 | V73: =RC[-12]+RC[-8]+RC[-4]+RC[-16] -> 1474105.6329999999
C74: 3.3.90.39.19 - Manutenção e Conserv. de Veículos | F74: 1745000 | J74: =RC[-4]*R5C[-1] -> 1774664.9999999998 | N74: =RC[-4]*R5C[-1] -> 1810158.2999999998 | R74: =RC[-4]*R5C[-1] -> 1855412.2574999996 | U74: =RC[-12]+RC[-8]+RC[-4]+RC[-16] -> 0 | V74: =RC[-12]+RC[-8]+RC[-4]+RC[-16] -> 7185235.5574999992
C75: 3.3.90.39.20 - Manut. e Cons. de Bens Móveis de Outras Naturezas | F75: 0 | J75: =RC[-4]*R5C[-1] -> 0 | N75: =RC[-4]*R5C[-1] -> 0 | R75: =RC[-4]*R5C[-1] -> 0 | U75: =RC[-12]+RC[-8]+RC[-4]+RC[-16] -> 0 | V75: =RC[-12]+RC[-8]+RC[-4]+RC[-16] -> 0
C76: 3.3.90.39.43 - Serviços de Energia Elétrica | F76: 1418000 | J76: =RC[-4]*R5C[-1] -> 1442105.9999999998 | N76: =RC[-4]*R5C[-1] -> 1470948.1199999999 | R76: =RC[-4]*R5C[-1] -> 1507721.8229999999 | U76: =RC[-12]+RC[-8]+RC[-4]+RC[-16] -> 0 | V76: =RC[-12]+RC[-8]+RC[-4]+RC[-16] -> 5838775.943
C77: 3.3.90.39.44 - Serviços de Água e Esgoto | F77: 1663000 | J77: =RC[-4]*R5C[-1] -> 1691270.9999999998 | N77: =RC[-4]*R5C[-1] -> 1725096.4199999997 | R77: =RC[-4]*R5C[-1] -> 1768223.8304999995 | U77: =RC[-12]+RC[-8]+RC[-4]+RC[-16] -> 0 | V77: =RC[-12]+RC[-8]+RC[-4]+RC[-16] -> 6847591.2504999992
C78: 3.3.90.39.45 - Serviços de Gás | F78: 0 | J78: =RC[-4]*R5C[-1] -> 0 | N78: =RC[-4]*R5C[-1] -> 0 | R78: =RC[-4]*R5C[-1] -> 0 | U78: =RC[-12]+RC[-8]+RC[-4]+RC[-16] -> 0 | V78: =RC[-12]+RC[-8]+RC[-4]+RC[-16] -> 0
C79: 3.3.90.39.46 - Serviços Domésticos (Lavanderia) | F79: 0 | J79: =RC[-4]*R5C[-1] -> 0 | N79: =RC[-4]*R5C[-1] -> 0 | R79: =RC[-4]*R5C[-1] -> 0 | U79: =RC[-12]+RC[-8]+RC[-4]+RC[-16] -> 0 | V79: =RC[-12]+RC[-8]+RC[-4]+RC[-16] -> 0
C80: 3.3.90.39.47 - Serviços de Comunicação em Geral (Correios) | F80: 58000 | J80: =RC[-4]*R5C[-1] -> 58985.999999999993 | N80: =RC[-4]*R5C[-1] -> 60165.719999999994 | R80: =RC[-4]*R5C[-1] -> 61669.86299999999 | U80: =RC[-12]+RC[-8]+RC[-4]+RC[-16] -> 0 | V80: =RC[-12]+RC[-8]+RC[-4]+RC[-16] -> 238821.58299999998
C81: 3.3.90.39.57 - Serviços Técnicos Profissionais de TI | F81: 0 | J81: =RC[-4]*R5C[-1] -> 0 | N81: =RC[-4]*R5C[-1] -> 0 | R81: =RC[-4]*R5C[-1] -> 0 | U81: =RC[-12]+RC[-8]+RC[-4]+RC[-16] -> 0 | V81: =RC[-12]+RC[-8]+RC[-4]+RC[-16] -> 0
C82: 3.3.90.39.58 - Serviços de Telecomunicações - (Telefone) | F82: 250000 | J82: =RC[-4]*R5C[-1]+96630 -> 350880 | N82: =RC[-4]*R5C[-1] -> 357897.60000000003 | R82: =RC[-4]*R5C[-1] -> 366845.04 | U82: =RC[-12]+RC[-8]+RC[-4]+RC[-16] -> 0 | V82: =RC[-12]+RC[-8]+RC[-4]+RC[-16] -> 1325622.6400000001
C83: 3.3.90.39.63 - Serviços Gráficos e Editoriais | F83: 0 | J83: =RC[-4]*R5C[-1] -> 0 | N83: =RC[-4]*R5C[-1] -> 0 | R83: =RC[-4]*R5C[-1] -> 0 | U83: =RC[-12]+RC[-8]+RC[-4]+RC[-16] -> 0 | V83: =RC[-12]+RC[-8]+RC[-4]+RC[-16] -> 0
C84: 3.3.90.39.67 - Serviços Funerários | F84: 300000 | J84: =RC[-4]*R5C[-1] -> 305100 | N84: =RC[-4]*R5C[-1] -> 311202 | R84: =RC[-4]*R5C[-1] -> 318982.05 | U84: =RC[-12]+RC[-8]+RC[-4]+RC[-16] -> 0 | V84: =RC[-12]+RC[-8]+RC[-4]+RC[-16] -> 1235284.05
C85: 3.3.90.39.69 - Seguros em Geral | F85: 0 | J85: =RC[-4]*R5C[-1] -> 0 | N85: =RC[-4]*R5C[-1] -> 0 | R85: =RC[-4]*R5C[-1] -> 0 | U85: =RC[-12]+RC[-8]+RC[-4]+RC[-16] -> 0 | V85: =RC[-12]+RC[-8]+RC[-4]+RC[-16] -> 0
C86: 3.3.90.39.70 - Confecções de Uniformes, Bandeiras e Flâmulas | F86: 0 | J86: =RC[-4]*R5C[-1] -> 0 | N86: =RC[-4]*R5C[-1] -> 0 | R86: =RC[-4]*R5C[-1] -> 0 | U86: =RC[-12]+RC[-8]+RC[-4]+RC[-16] -> 0 | V86: =RC[-12]+RC[-8]+RC[-4]+RC[-16] -> 0
C87: 3.3.90.39.74 Fretes e Transp. de Encomendas | F87: 0 | J87: =RC[-4]*R5C[-1] -> 0 | N87: =RC[-4]*R5C[-1] -> 0 | R87: =RC[-4]*R5C[-1] -> 0 | U87: =RC[-12]+RC[-8]+RC[-4]+RC[-16] -> 0 | V87: =RC[-12]+RC[-8]+RC[-4]+RC[-16] -> 0
C88: 3.3.90.39.75 - Serviço de Incineração, Destruição e Demolição | F88: 0 | J88: =RC[-4]*R5C[-1] -> 0 | N88: =RC[-4]*R5C[-1] -> 0 | R88: =RC[-4]*R5C[-1] -> 0 | U88: =RC[-12]+RC[-8]+RC[-4]+RC[-16] -> 0 | V88: =RC[-12]+RC[-8]+RC[-4]+RC[-16] -> 0
C89: 3.3.90.39.78 - Limpeza e Conservação | F89: 0 | J89: =RC[-4]*R5C[-1] -> 0 | N89: =RC[-4]*R5C[-1] -> 0 | R89: =RC[-4]*R5C[-1] -> 0 | U89: =RC[-12]+RC[-8]+RC[-4]+RC[-16] -> 0 | V89: =RC[-12]+RC[-8]+RC[-4]+RC[-16] -> 0
C90: 3.3.90.39.80 - Hospedagens | F90: 287300 | J90: =RC[-4]*R5C[-1] -> 292184.09999999998 | N90: =RC[-4]*R5C[-1] -> 298027.78200000001 | R90: =RC[-4]*R5C[-1] -> 305478.47654999996 | U90: =RC[-12]+RC[-8]+RC[-4]+RC[-16] -> 0 | V90: =RC[-12]+RC[-8]+RC[-4]+RC[-16] -> 1182990.35855
C91: 3.3.90.39.83 - Serviços de Cópias e Reprodução de Documentos | F91: 0 | J91: =RC[-4]*R5C[-1] -> 0 | N91: =RC[-4]*R5C[-1] -> 0 | R91: =RC[-4]*R5C[-1] -> 0 | U91: =RC[-12]+RC[-8]+RC[-4]+RC[-16] -> 0 | V91: =RC[-12]+RC[-8]+RC[-4]+RC[-16] -> 0
C92: 3390.39.95 - Manutenção e Conserv. Equip. de Processamento de dados | F92: 0 | J92: =RC[-4]*R5C[-1] -> 0 | N92: =RC[-4]*R5C[-1] -> 0 | R92: =RC[-4]*R5C[-1] -> 0 | U92: =RC[-12]+RC[-8]+RC[-4]+RC[-16] -> 0 | V92: =RC[-12]+RC[-8]+RC[-4]+RC[-16] -> 0
C93: 3.3.90.39.97 - Comunicação de Dados | F93: 0 | J93: =RC[-4]*R5C[-1] -> 0 | N93: =RC[-4]*R5C[-1] -> 0 | R93: =RC[-4]*R5C[-1] -> 0 | U93: =RC[-12]+RC[-8]+RC[-4]+RC[-16] -> 0 | V93: =RC[-12]+RC[-8]+RC[-4]+RC[-16] -> 0
C94: 3.3.91.39.01 - Assinaturas e Periódicos e Anuidades | F94: 0 | J94: =RC[-4]*R5C[-1] -> 0 | N94: =RC[-4]*R5C[-1] -> 0 | R94: =RC[-4]*R5C[-1] -> 0 | U94: =RC[-12]+RC[-8]+RC[-4]+RC[-16] -> 0 | V94: =RC[-12]+RC[-8]+RC[-4]+RC[-16] -> 0
C95: 3.3.91.39.47 - Serviços de Comunicação em Geral | F95: 0 | J95: =RC[-4]*R5C[-1] -> 0 | N95: =RC[-4]*R5C[-1] -> 0 | R95: =RC[-4]*R5C[-1] -> 0 | U95: =RC[-12]+RC[-8]+RC[-4]+RC[-16] -> 0 | V95: =RC[-12]+RC[-8]+RC[-4]+RC[-16] -> 0
C96: 3.3.91.39.90 - Serviços de Publicidade Legal | F96: 37000 | J96: =RC[-4]*R5C[-1] -> 37629 | N96: =RC[-4]*R5C[-1] -> 38381.58 | R96: =RC[-4]*R5C[-1] -> 39341.119500000001 | U96: =RC[-12]+RC[-8]+RC[-4]+RC[-16] -> 0 | V96: =RC[-12]+RC[-8]+RC[-4]+RC[-16] -> 152351.69949999999
B98: TOTAL | E98: =SUM(R[-90]C:R[-81]C) -> 69227733.452198207 | F98: =SUM(R[-90]C:R[-81]C)+SUM(R[-90]C[-2]:R[-82]C[-1]) -> 69327718.415198207 | I98: =SUM(R[-90]C:R[-81]C) -> 70394889.267715573 | J98: =SUM(R[-90]C:R[-81]C)+SUM(R[-90]C[-2]:R[-82]C[-1]) -> 70496588.975086585 | M98: =SUM(R[-90]C:R[-81]C) -> 71791356.872869894 | N98: =SUM(R[-90]C:R[-81]C)+SUM(R[-90]C[-2]:R[-82]C[-1]) -> 71895090.57438831 | Q98: =SUM(R[-90]C:R[-81]C) -> 73571853.069441631 | R98: =SUM(R[-90]C:R[-81]C)+SUM(R[-90]C[-2]:R[-82]C[-1]) -> 73678180.113498017 | U98: =SUM(R[-90]C:R[-81]C) -> 284985832.66222531 | V98: =SUM(R[-90]C:R[-81]C)+SUM(R[-90]C[-2]:R[-82]C[-1]) -> 285397578.07817113