Sheet: Investimento
C2: SESAI :: PLANO DISTRITAL DE SAÚDE INDÍGENA 2016-2019
C3: PREVISÃO ORÇAMENTÁRIA 2016-2019
C4: =Custeio!RC[-1] -> DSEI %= current_dsei.name %>
I6: PREVISÃO ORÇAMENTÁRIA 2016 | M6: PREVISÃO ORÇAMENTÁRIA 2017 | Q6: PREVISÃO ORÇAMENTÁRIA 2018 | U6: PREVISÃO ORÇAMENTÁRIA 2019 | Y6: PREVISÃO ORÇAMENTÁRIA PDSI 2016-2109 (TOTAL)
B7: Natureza de Despesa (Código SIAFI) | I7: QUANTIDADE CONCLUÍDA EM 2016 | J7: VALOR UNITÁRIO ESTIMADO (R$ em 2016) | K7: PREVISÃO ORÇAMENTÁRIA 2016 (em R$) | M7: QUANTIDADE CONCLUÍDA EM 2017 | N7: VALOR UNITÁRIO ESTIMADO (R$ em 2017) | O7: PREVISÃO ORÇAMENTÁRIA 2017 (em R$) | Q7: QUANTIDADE CONCLUÍDA EM 2018 | R7: VALOR UNITÁRIO ESTIMADO (R$ em 2018) | S7: PREVISÃO ORÇAMENTÁRIA 2018 (em R$) | U7: QUANTIDADE CONCLUÍDA EM 2019 | V7: VALOR UNITÁRIO ESTIMADO (R$ em 2019) | W7: PREVISÃO ORÇAMENTÁRIA 2019 (em R$) | Y7: QUANTIDADE CONCLUÍDAS 2016-2019 | Z7: PREVISÃO ORÇAMENTÁRIA DOS 4 ANOS (2016-2019) (em R$)
B8: 4.4.90.51.91 | C8: OBRAS DE EDIFICAÇÕES | E8: MUNICÍPIO | F8: ALDEIA | G8: POLO BASE
D9: CASAI | I9: =SUM(R[1]C:R[15]C) -> 0 | K9: =SUM(R[1]C:R[15]C) -> 0 | M9: =SUM(R[1]C:R[15]C) -> 0 | O9: =SUM(R[1]C:R[15]C) -> 0 | Q9: =SUM(R[1]C:R[15]C) -> 0 | S9: =SUM(R[1]C:R[15]C) -> 0 | U9: =SUM(R[1]C:R[15]C) -> 0 | W9: =SUM(R[1]C:R[15]C) -> 0 | Y9: =RC[-4]+RC[-8]+RC[-12]+RC[-16] -> 0 | Z9: =RC[-3]+RC[-7]+RC[-11]+RC[-15] -> 0
D10: CASAI A | K10: =RC[-1] -> 0 | O10: =RC[-1] -> 0 | S10: =RC[-1] -> 0 | W10: =RC[-1] -> 0 | Y10: =RC[-4]+RC[-8]+RC[-12]+RC[-16] -> 0 | Z10: =RC[-3]+RC[-7]+RC[-11]+RC[-15] -> 0
D11: CASAI B | K11: =RC[-1] -> 0 | O11: =RC[-1] -> 0 | S11: =RC[-1] -> 0 | W11: =RC[-1] -> 0 | Y11: =RC[-4]+RC[-8]+RC[-12]+RC[-16] -> 0 | Z11: =RC[-3]+RC[-7]+RC[-11]+RC[-15] -> 0 | XDO11: 100000
D12: CASAI C | K12: =RC[-1] -> 0 | O12: =RC[-1] -> 0 | S12: =RC[-1] -> 0 | W12: =RC[-1] -> 0 | Y12: =RC[-4]+RC[-8]+RC[-12]+RC[-16] -> 0 | Z12: =RC[-3]+RC[-7]+RC[-11]+RC[-15] -> 0
D13: CASAI D | K13: =RC[-1] -> 0 | O13: =RC[-1] -> 0 | S13: =RC[-1] -> 0 | W13: =RC[-1] -> 0 | Y13: =RC[-4]+RC[-8]+RC[-12]+RC[-16] -> 0 | Z13: =RC[-3]+RC[-7]+RC[-11]+RC[-15] -> 0
D14: CASAI E | K14: =RC[-1] -> 0 | O14: =RC[-1] -> 0 | S14: =RC[-1] -> 0 | W14: =RC[-1] -> 0 | Y14: =RC[-4]+RC[-8]+RC[-12]+RC[-16] -> 0 | Z14: =RC[-3]+RC[-7]+RC[-11]+RC[-15] -> 0
D15: CASAI F | K15: =RC[-1] -> 0 | O15: =RC[-1] -> 0 | S15: =RC[-1] -> 0 | W15: =RC[-1] -> 0 | Y15: =RC[-4]+RC[-8]+RC[-12]+RC[-16] -> 0 | Z15: =RC[-3]+RC[-7]+RC[-11]+RC[-15] -> 0
D16: CASAI G | K16: =RC[-1] -> 0 | O16: =RC[-1] -> 0 | S16: =RC[-1] -> 0 | W16: =RC[-1] -> 0 | Y16: =RC[-4]+RC[-8]+RC[-12]+RC[-16] -> 0 | Z16: =RC[-3]+RC[-7]+RC[-11]+RC[-15] -> 0 | XDO16: 100000
D17: CASAI H | K17: =RC[-1] -> 0 | O17: =RC[-1] -> 0 | S17: =RC[-1] -> 0 | W17: =RC[-1] -> 0 | Y17: =RC[-4]+RC[-8]+RC[-12]+RC[-16] -> 0 | Z17: =RC[-3]+RC[-7]+RC[-11]+RC[-15] -> 0
D18: CASAI I | K18: =RC[-1] -> 0 | O18: =RC[-1] -> 0 | S18: =RC[-1] -> 0 | W18: =RC[-1] -> 0 | Y18: =RC[-4]+RC[-8]+RC[-12]+RC[-16] -> 0 | Z18: =RC[-3]+RC[-7]+RC[-11]+RC[-15] -> 0
D19: CASAI … | K19: =RC[-1] -> 0 | O19: =RC[-1] -> 0 | S19: =RC[-1] -> 0 | W19: =RC[-1] -> 0 | Y19: =RC[-4]+RC[-8]+RC[-12]+RC[-16] -> 0 | Z19: =RC[-3]+RC[-7]+RC[-11]+RC[-15] -> 0
D20: CASAI … | K20: =RC[-1] -> 0 | O20: =RC[-1] -> 0 | S20: =RC[-1] -> 0 | W20: =RC[-1] -> 0 | Y20: =RC[-4]+RC[-8]+RC[-12]+RC[-16] -> 0 | Z20: =RC[-3]+RC[-7]+RC[-11]+RC[-15] -> 0
D21: CASAI … | K21: =RC[-1] -> 0 | O21: =RC[-1] -> 0 | S21: =RC[-1] -> 0 | W21: =RC[-1] -> 0 | Y21: =RC[-4]+RC[-8]+RC[-12]+RC[-16] -> 0 | Z21: =RC[-3]+RC[-7]+RC[-11]+RC[-15] -> 0 | XDO21: 100000
D22: CASAI … | K22: =RC[-1] -> 0 | O22: =RC[-1] -> 0 | S22: =RC[-1] -> 0 | W22: =RC[-1] -> 0 | Y22: =RC[-4]+RC[-8]+RC[-12]+RC[-16] -> 0 | Z22: =RC[-3]+RC[-7]+RC[-11]+RC[-15] -> 0
D23: CASAI … | K23: =RC[-1] -> 0 | O23: =RC[-1] -> 0 | S23: =RC[-1] -> 0 | W23: =RC[-1] -> 0 | Y23: =RC[-4]+RC[-8]+RC[-12]+RC[-16] -> 0 | Z23: =RC[-3]+RC[-7]+RC[-11]+RC[-15] -> 0
D24: CASAI … | K24: =RC[-1] -> 0 | O24: =RC[-1] -> 0 | S24: =RC[-1] -> 0 | W24: =RC[-1] -> 0 | Y24: =RC[-4]+RC[-8]+RC[-12]+RC[-16] -> 0 | Z24: =RC[-3]+RC[-7]+RC[-11]+RC[-15] -> 0
D25: UNIDADE BÁSICA DE SAÚDE INDÍGENA (UBSI) - Tipo I | I25: =SUM(R[1]C:R[30]C) -> 0 | K25: =SUM(R[1]C:R[30]C) -> 0 | M25: =SUM(R[1]C:R[30]C) -> 10 | O25: =SUM(R[1]C:R[30]C) -> 600000 | Q25: =SUM(R[1]C:R[30]C) -> 10 | S25: =SUM(R[1]C:R[30]C) -> 600000 | U25: =SUM(R[1]C:R[30]C) -> 10 | W25: =SUM(R[1]C:R[30]C) -> 600000 | Y25: =RC[-4]+RC[-8]+RC[-12]+RC[-16] -> 30 | Z25: =RC[-3]+RC[-7]+RC[-11]+RC[-15] -> 1800000
D26: UBSI TIPO 1 - Conteiner 1 | K26: =RC[-1] -> 0 | M26: 1 | N26: 60000 | O26: =RC[-1] -> 60000 | S26: =RC[-1] -> 0 | W26: =RC[-1] -> 0 | Y26: =RC[-4]+RC[-8]+RC[-12]+RC[-16] -> 1 | Z26: =RC[-3]+RC[-7]+RC[-11]+RC[-15] -> 60000
D27: UBSI TIPO 1 - Conteiner 2 | K27: =RC[-1] -> 0 | M27: 1 | N27: 60000 | O27: =RC[-1] -> 60000 | S27: =RC[-1] -> 0 | W27: =RC[-1] -> 0 | Y27: =RC[-4]+RC[-8]+RC[-12]+RC[-16] -> 1 | Z27: =RC[-3]+RC[-7]+RC[-11]+RC[-15] -> 60000 | XDO27: 100000
D28: UBSI TIPO 1 - Conteiner 3 | K28: =RC[-1] -> 0 | M28: 1 | N28: 60000 | O28: =RC[-1] -> 60000 | S28: =RC[-1] -> 0 | W28: =RC[-1] -> 0 | Y28: =RC[-4]+RC[-8]+RC[-12]+RC[-16] -> 1 | Z28: =RC[-3]+RC[-7]+RC[-11]+RC[-15] -> 60000
D29: UBSI TIPO 1 - Conteiner 4 | K29: =RC[-1] -> 0 | M29: 1 | N29: 60000 | O29: =RC[-1] -> 60000 | S29: =RC[-1] -> 0 | W29: =RC[-1] -> 0 | Y29: =RC[-4]+RC[-8]+RC[-12]+RC[-16] -> 1 | Z29: =RC[-3]+RC[-7]+RC[-11]+RC[-15] -> 60000
D30: UBSI TIPO 1 - Conteiner 5 | K30: =RC[-1] -> 0 | M30: 1 | N30: 60000 | O30: =RC[-1] -> 60000 | S30: =RC[-1] -> 0 | W30: =RC[-1] -> 0 | Y30: =RC[-4]+RC[-8]+RC[-12]+RC[-16] -> 1 | Z30: =RC[-3]+RC[-7]+RC[-11]+RC[-15] -> 60000
D31: UBSI TIPO 1 - Conteiner 6 | K31: =RC[-1] -> 0 | M31: 1 | N31: 60000 | O31: =RC[-1] -> 60000 | S31: =RC[-1] -> 0 | W31: =RC[-1] -> 0 | Y31: =RC[-4]+RC[-8]+RC[-12]+RC[-16] -> 1 | Z31: =RC[-3]+RC[-7]+RC[-11]+RC[-15] -> 60000
D32: UBSI TIPO 1 - Conteiner 7 | K32: =RC[-1] -> 0 | M32: 1 | N32: 60000 | O32: =RC[-1] -> 60000 | S32: =RC[-1] -> 0 | W32: =RC[-1] -> 0 | Y32: =RC[-4]+RC[-8]+RC[-12]+RC[-16] -> 1 | Z32: =RC[-3]+RC[-7]+RC[-11]+RC[-15] -> 60000 | XDO32: 100000
D33: UBSI TIPO 1 - Conteiner 8 | K33: =RC[-1] -> 0 | M33: 1 | N33: 60000 | O33: =RC[-1] -> 60000 | S33: =RC[-1] -> 0 | W33: =RC[-1] -> 0 | Y33: =RC[-4]+RC[-8]+RC[-12]+RC[-16] -> 1 | Z33: =RC[-3]+RC[-7]+RC[-11]+RC[-15] -> 60000
D34: UBSI TIPO 1 - Conteiner 9 | K34: =RC[-1] -> 0 | M34: 1 | N34: 60000 | O34: =RC[-1] -> 60000 | S34: =RC[-1] -> 0 | W34: =RC[-1] -> 0 | Y34: =RC[-4]+RC[-8]+RC[-12]+RC[-16] -> 1 | Z34: =RC[-3]+RC[-7]+RC[-11]+RC[-15] -> 60000
D35: UBSI TIPO 1 - Conteiner 10 | K35: =RC[-1] -> 0 | M35: 1 | N35: 60000 | O35: =RC[-1] -> 60000 | S35: =RC[-1] -> 0 | W35: =RC[-1] -> 0 | Y35: =RC[-4]+RC[-8]+RC[-12]+RC[-16] -> 1 | Z35: =RC[-3]+RC[-7]+RC[-11]+RC[-15] -> 60000
D36: UBSI TIPO 1 - Conteiner 11 | K36: =RC[-1] -> 0 | O36: =RC[-1] -> 0 | Q36: 1 | R36: 60000 | S36: =RC[-1] -> 60000 | W36: =RC[-1] -> 0 | Y36: =RC[-4]+RC[-8]+RC[-12]+RC[-16] -> 1 | Z36: =RC[-3]+RC[-7]+RC[-11]+RC[-15] -> 60000
D37: UBSI TIPO 1 - Conteiner 12 | K37: =RC[-1] -> 0 | O37: =RC[-1] -> 0 | Q37: 1 | R37: 60000 | S37: =RC[-1] -> 60000 | W37: =RC[-1] -> 0 | Y37: =RC[-4]+RC[-8]+RC[-12]+RC[-16] -> 1
D38: UBSI TIPO 1 - Conteiner 13 | K38: =RC[-1] -> 0 | O38: =RC[-1] -> 0 | Q38: 1 | R38: 60000 | S38: =RC[-1] -> 60000 | W38: =RC[-1] -> 0 | Y38: =RC[-4]+RC[-8]+RC[-12]+RC[-16] -> 1
D39: UBSI TIPO 1 - Conteiner 14 | K39: =RC[-1] -> 0 | O39: =RC[-1] -> 0 | Q39: 1 | R39: 60000 | S39: =RC[-1] -> 60000 | W39: =RC[-1] -> 0 | Y39: =RC[-4]+RC[-8]+RC[-12]+RC[-16] -> 1
D40: UBSI TIPO 1 - Conteiner 15 | K40: =RC[-1] -> 0 | O40: =RC[-1] -> 0 | Q40: 1 | R40: 60000 | S40: =RC[-1] -> 60000 | W40: =RC[-1] -> 0 | Y40: =RC[-4]+RC[-8]+RC[-12]+RC[-16] -> 1
D41: UBSI TIPO 1 - Conteiner 16 | K41: =RC[-1] -> 0 | O41: =RC[-1] -> 0 | Q41: 1 | R41: 60000 | S41: =RC[-1] -> 60000 | W41: =RC[-1] -> 0 | Y41: =RC[-4]+RC[-8]+RC[-12]+RC[-16] -> 1 | Z41: =RC[-3]+RC[-7]+RC[-11]+RC[-15] -> 60000 | XDO41: 100000
D42: UBSI TIPO 1 - Conteiner 17 | K42: =RC[-1] -> 0 | O42: =RC[-1] -> 0 | Q42: 1 | R42: 60000 | S42: =RC[-1] -> 60000 | W42: =RC[-1] -> 0 | Y42: =RC[-4]+RC[-8]+RC[-12]+RC[-16] -> 1 | Z42: =RC[-3]+RC[-7]+RC[-11]+RC[-15] -> 60000
D43: UBSI TIPO 1 - Conteiner 18 | K43: =RC[-1] -> 0 | O43: =RC[-1] -> 0 | Q43: 1 | R43: 60000 | S43: =RC[-1] -> 60000 | W43: =RC[-1] -> 0 | Y43: =RC[-4]+RC[-8]+RC[-12]+RC[-16] -> 1 | Z43: =RC[-3]+RC[-7]+RC[-11]+RC[-15] -> 60000
D44: UBSI TIPO 1 - Conteiner 19 | K44: =RC[-1] -> 0 | O44: =RC[-1] -> 0 | Q44: 1 | R44: 60000 | S44: =RC[-1] -> 60000 | W44: =RC[-1] -> 0 | Y44: =RC[-4]+RC[-8]+RC[-12]+RC[-16] -> 1 | Z44: =RC[-3]+RC[-7]+RC[-11]+RC[-15] -> 60000
D45: UBSI TIPO 1 - Conteiner 20 | K45: =RC[-1] -> 0 | O45: =RC[-1] -> 0 | Q45: 1 | R45: 60000 | S45: =RC[-1] -> 60000 | W45: =RC[-1] -> 0 | Y45: =RC[-4]+RC[-8]+RC[-12]+RC[-16] -> 1
D46: UBSI TIPO 1 - Conteiner 21 | K46: =RC[-1] -> 0 | O46: =RC[-1] -> 0 | S46: =RC[-1] -> 0 | U46: 1 | V46: 60000 | W46: =RC[-1] -> 60000 | Y46: =RC[-4]+RC[-8]+RC[-12]+RC[-16] -> 1
D47: UBSI TIPO 1 - Conteiner 22 | K47: =RC[-1] -> 0 | O47: =RC[-1] -> 0 | S47: =RC[-1] -> 0 | U47: 1 | V47: 60000 | W47: =RC[-1] -> 60000 | Y47: =RC[-4]+RC[-8]+RC[-12]+RC[-16] -> 1
D48: UBSI TIPO 1 - Conteiner 23 | K48: =RC[-1] -> 0 | O48: =RC[-1] -> 0 | S48: =RC[-1] -> 0 | U48: 1 | V48: 60000 | W48: =RC[-1] -> 60000 | Y48: =RC[-4]+RC[-8]+RC[-12]+RC[-16] -> 1
D49: UBSI TIPO 1 - Conteiner 24 | K49: =RC[-1] -> 0 | O49: =RC[-1] -> 0 | S49: =RC[-1] -> 0 | U49: 1 | V49: 60000 | W49: =RC[-1] -> 60000 | Y49: =RC[-4]+RC[-8]+RC[-12]+RC[-16] -> 1
D50: UBSI TIPO 1 - Conteiner 25 | K50: =RC[-1] -> 0 | O50: =RC[-1] -> 0 | S50: =RC[-1] -> 0 | U50: 1 | V50: 60000 | W50: =RC[-1] -> 60000 | Y50: =RC[-4]+RC[-8]+RC[-12]+RC[-16] -> 1
D51: UBSI TIPO 1 - Conteiner 26 | K51: =RC[-1] -> 0 | O51: =RC[-1] -> 0 | S51: =RC[-1] -> 0 | U51: 1 | V51: 60000 | W51: =RC[-1] -> 60000 | Y51: =RC[-4]+RC[-8]+RC[-12]+RC[-16] -> 1 | Z51: =RC[-3]+RC[-7]+RC[-11]+RC[-15] -> 60000
D52: UBSI TIPO 1 - Conteiner 27 | K52: =RC[-1] -> 0 | O52: =RC[-1] -> 0 | S52: =RC[-1] -> 0 | U52: 1 | V52: 60000 | W52: =RC[-1] -> 60000 | Y52: =RC[-4]+RC[-8]+RC[-12]+RC[-16] -> 1 | Z52: =RC[-3]+RC[-7]+RC[-11]+RC[-15] -> 60000 | XDO52: 100000
D53: UBSI TIPO 1 - Conteiner 28 | K53: =RC[-1] -> 0 | O53: =RC[-1] -> 0 | S53: =RC[-1] -> 0 | U53: 1 | V53: 60000 | W53: =RC[-1] -> 60000 | Y53: =RC[-4]+RC[-8]+RC[-12]+RC[-16] -> 1 | Z53: =RC[-3]+RC[-7]+RC[-11]+RC[-15] -> 60000
D54: UBSI TIPO 1 - Conteiner 29 | K54: =RC[-1] -> 0 | O54: =RC[-1] -> 0 | S54: =RC[-1] -> 0 | U54: 1 | V54: 60000 | W54: =RC[-1] -> 60000 | Y54: =RC[-4]+RC[-8]+RC[-12]+RC[-16] -> 1 | Z54: =RC[-3]+RC[-7]+RC[-11]+RC[-15] -> 60000
D55: UBSI TIPO 1 - Conteiner 30 | K55: =RC[-1] -> 0 | O55: =RC[-1] -> 0 | S55: =RC[-1] -> 0 | U55: 1 | V55: 60000 | W55: =RC[-1] -> 60000 | Y55: =RC[-4]+RC[-8]+RC[-12]+RC[-16] -> 1 | Z55: =RC[-3]+RC[-7]+RC[-11]+RC[-15] -> 60000
D56: UNIDADE BÁSICA DE SAÚDE INDÍGENA (UBSI) - Tipo II | I56: =SUM(R[1]C:R[19]C) -> 2 | K56: =SUM(R[1]C:R[20]C) -> 718000 | M56: =SUM(R[1]C:R[19]C) -> 6 | O56: =SUM(R[1]C:R[20]C) -> 3000000 | Q56: =SUM(R[1]C:R[19]C) -> 4 | S56: =SUM(R[1]C:R[20]C) -> 2200000 | U56: =SUM(R[1]C:R[19]C) -> 4 | W56: =SUM(R[1]C:R[20]C) -> 2400000 | Y56: =RC[-4]+RC[-8]+RC[-12]+RC[-16] -> 16 | Z56: =RC[-3]+RC[-7]+RC[-11]+RC[-15] -> 8318000
D57: UBSI TIPO II - Toldo Pinhal (SC) | I57: 1 | J57: 334000 | K57: =RC[-1] -> 334000 | O57: =RC[-1] -> 0 | S57: =RC[-1] -> 0 | W57: =RC[-1] -> 0 | Y57: =RC[-4]+RC[-8]+RC[-12]+RC[-16] -> 1 | Z57: =RC[-3]+RC[-7]+RC[-11]+RC[-15] -> 334000
D58: UBSI TIPO II - Coqueiro (SC) | I58: 1 | J58: 384000 | K58: =RC[-1] -> 384000 | O58: =RC[-1] -> 0 | S58: =RC[-1] -> 0 | W58: =RC[-1] -> 0 | Y58: =RC[-4]+RC[-8]+RC[-12]+RC[-16] -> 1 | Z58: =RC[-3]+RC[-7]+RC[-11]+RC[-15] -> 384000 | XDO58: 100000
D59: UBSI TIPO II - Pinhalzinho (SC) | K59: =RC[-1] -> 0 | M59: 1 | N59: 500000 | O59: =RC[-1] -> 500000 | S59: =RC[-1] -> 0 | W59: =RC[-1] -> 0 | Y59: =RC[-4]+RC[-8]+RC[-12]+RC[-16] -> 1 | Z59: =RC[-3]+RC[-7]+RC[-11]+RC[-15] -> 500000
D60: UBSI TIPO II - Km10 (RS) | K60: =RC[-1] -> 0 | M60: 1 | N60: 500000 | O60: =RC[-1] -> 500000 | S60: =RC[-1] -> 0 | W60: =RC[-1] -> 0 | Y60: =RC[-4]+RC[-8]+RC[-12]+RC[-16] -> 1 | Z60: =RC[-3]+RC[-7]+RC[-11]+RC[-15] -> 500000
D61: UBSI TIPO II - Três Soitas (RS) | K61: =RC[-1] -> 0 | M61: 1 | N61: 500000 | O61: =RC[-1] -> 500000 | S61: =RC[-1] -> 0 | W61: =RC[-1] -> 0 | Y61: =RC[-4]+RC[-8]+RC[-12]+RC[-16] -> 1 | Z61: =RC[-3]+RC[-7]+RC[-11]+RC[-15] -> 500000
D62: UBSI TIPO II - Konda (SC) | K62: =RC[-1] -> 0 | M62: 1 | N62: 500000 | O62: =RC[-1] -> 500000 | S62: =RC[-1] -> 0 | W62: =RC[-1] -> 0 | Y62: =RC[-4]+RC[-8]+RC[-12]+RC[-16] -> 1 | Z62: =RC[-3]+RC[-7]+RC[-11]+RC[-15] -> 500000
D63: UBSI TIPO II - Pavão (SC) | K63: =RC[-1] -> 0 | M63: 1 | N63: 500000 | O63: =RC[-1] -> 500000 | S63: =RC[-1] -> 0 | W63: =RC[-1] -> 0 | Y63: =RC[-4]+RC[-8]+RC[-12]+RC[-16] -> 1 | Z63: =RC[-3]+RC[-7]+RC[-11]+RC[-15] -> 500000 | XDO63: 100000
D64: UBSI TIPO II - Missão (RS) | K64: =RC[-1] -> 0 | M64: 1 | N64: 500000 | O64: =RC[-1] -> 500000 | S64: =RC[-1] -> 0 | W64: =RC[-1] -> 0 | Y64: =RC[-4]+RC[-8]+RC[-12]+RC[-16] -> 1 | Z64: =RC[-3]+RC[-7]+RC[-11]+RC[-15] -> 500000
D65: UBSI TIPO II - Imbu (SC) | K65: =RC[-1] -> 0 | O65: =RC[-1] -> 0 | Q65: 1 | R65: 550000 | S65: =RC[-1] -> 550000 | W65: =RC[-1] -> 0 | Y65: =RC[-4]+RC[-8]+RC[-12]+RC[-16] -> 1 | Z65: =RC[-3]+RC[-7]+RC[-11]+RC[-15] -> 550000
D66: UBSI TIPO II - Chimbangue (SC) | K66: =RC[-1] -> 0 | O66: =RC[-1] -> 0 | Q66: 1 | R66: 550000 | S66: =RC[-1] -> 550000 | W66: =RC[-1] -> 0 | Y66: =RC[-4]+RC[-8]+RC[-12]+RC[-16] -> 1 | Z66: =RC[-3]+RC[-7]+RC[-11]+RC[-15] -> 550000
D67: UBSI TIPO II - Votouro (RS) | K67: =RC[-1] -> 0 | O67: =RC[-1] -> 0 | Q67: 1 | R67: 550000 | S67: =RC[-1] -> 550000 | W67: =RC[-1] -> 0 | Y67: =RC[-4]+RC[-8]+RC[-12]+RC[-16] -> 1 | Z67: =RC[-3]+RC[-7]+RC[-11]+RC[-15] -> 550000
D68: UBSI TIPO II - Pinhalzinho (RS) | K68: =RC[-1] -> 0 | O68: =RC[-1] -> 0 | Q68: 1 | R68: 550000 | S68: =RC[-1] -> 550000 | W68: =RC[-1] -> 0 | Y68: =RC[-4]+RC[-8]+RC[-12]+RC[-16] -> 1 | Z68: =RC[-3]+RC[-7]+RC[-11]+RC[-15] -> 550000 | XDO68: 100000
D69: UBSI TIPO II - Biguacu (SC) | K69: =RC[-1] -> 0 | O69: =RC[-1] -> 0 | S69: =RC[-1] -> 0 | U69: 1 | V69: 600000 | W69: =RC[-1] -> 600000 | Y69: =RC[-4]+RC[-8]+RC[-12]+RC[-16] -> 1 | Z69: =RC[-3]+RC[-7]+RC[-11]+RC[-15] -> 600000
D70: UBSI TIPO II - Imarui (SC) | K70: =RC[-1] -> 0 | O70: =RC[-1] -> 0 | S70: =RC[-1] -> 0 | U70: 1 | V70: 600000 | W70: =RC[-1] -> 600000 | Y70: =RC[-4]+RC[-8]+RC[-12]+RC[-16] -> 1 | Z70: =RC[-3]+RC[-7]+RC[-11]+RC[-15] -> 600000
D71: UBSI TIPO II - RS | K71: =RC[-1] -> 0 | O71: =RC[-1] -> 0 | S71: =RC[-1] -> 0 | U71: 1 | V71: 600000 | W71: =RC[-1] -> 600000 | Y71: =RC[-4]+RC[-8]+RC[-12]+RC[-16] -> 1 | Z71: =RC[-3]+RC[-7]+RC[-11]+RC[-15] -> 600000
D72: UBSI TIPO II - RS | K72: =RC[-1] -> 0 | O72: =RC[-1] -> 0 | S72: =RC[-1] -> 0 | U72: 1 | V72: 600000 | W72: =RC[-1] -> 600000 | Y72: =RC[-4]+RC[-8]+RC[-12]+RC[-16] -> 1 | Z72: =RC[-3]+RC[-7]+RC[-11]+RC[-15] -> 600000
D73: UBSI TIPO II - XXXXXX | K73: =RC[-1] -> 0 | O73: =RC[-1] -> 0 | S73: =RC[-1] -> 0 | W73: =RC[-1] -> 0 | Y73: =RC[-4]+RC[-8]+RC[-12]+RC[-16] -> 0 | Z73: =RC[-3]+RC[-7]+RC[-11]+RC[-15] -> 0 | XDO73: 100000
D74: UBSI TIPO II - XXXXXX | K74: =RC[-1] -> 0 | O74: =RC[-1] -> 0 | S74: =RC[-1] -> 0 | W74: =RC[-1] -> 0 | Y74: =RC[-4]+RC[-8]+RC[-12]+RC[-16] -> 0 | Z74: =RC[-3]+RC[-7]+RC[-11]+RC[-15] -> 0
D75: UBSI TIPO II - XXXXXX | K75: =RC[-1] -> 0 | O75: =RC[-1] -> 0 | S75: =RC[-1] -> 0 | W75: =RC[-1] -> 0 | Y75: =RC[-4]+RC[-8]+RC[-12]+RC[-16] -> 0 | Z75: =RC[-3]+RC[-7]+RC[-11]+RC[-15] -> 0
D76: UBSI TIPO II - XXXXXX | K76: =RC[-1] -> 0 | O76: =RC[-1] -> 0 | S76: =RC[-1] -> 0 | W76: =RC[-1] -> 0 | Y76: =RC[-4]+RC[-8]+RC[-12]+RC[-16] -> 0 | Z76: =RC[-3]+RC[-7]+RC[-11]+RC[-15] -> 0
D77: UNIDADE BÁSICA DE SAÚDE INDÍGENA (UBSI) - Tipo III | I77: =SUM(R[1]C:R[19]C) -> 0 | K77: =SUM(R[1]C:R[20]C) -> 0 | M77: =SUM(R[1]C:R[19]C) -> 0 | O77: =SUM(R[1]C:R[20]C) -> 0 | Q77: =SUM(R[1]C:R[19]C) -> 0 | S77: =SUM(R[1]C:R[20]C) -> 0 | U77: =SUM(R[1]C:R[19]C) -> 0 | W77: =SUM(R[1]C:R[20]C) -> 0 | Y77: =RC[-4]+RC[-8]+RC[-12]+RC[-16] -> 0 | Z77: =RC[-3]+RC[-7]+RC[-11]+RC[-15] -> 0
D78: UBSI TIPO III - XXXXXX | K78: =RC[-1] -> 0 | O78: =RC[-1] -> 0 | S78: =RC[-1] -> 0 | W78: =RC[-1] -> 0 | Y78: =RC[-4]+RC[-8]+RC[-12]+RC[-16] -> 0 | Z78: =RC[-3]+RC[-7]+RC[-11]+RC[-15] -> 0
D79: UBSI TIPO III - XXXXXX | K79: =RC[-1] -> 0 | O79: =RC[-1] -> 0 | S79: =RC[-1] -> 0 | W79: =RC[-1] -> 0 | Y79: =RC[-4]+RC[-8]+RC[-12]+RC[-16] -> 0 | Z79: =RC[-3]+RC[-7]+RC[-11]+RC[-15] -> 0 | XDO79: 100000
D80: UBSI TIPO III - XXXXXX | K80: =RC[-1] -> 0 | O80: =RC[-1] -> 0 | S80: =RC[-1] -> 0 | W80: =RC[-1] -> 0 | Y80: =RC[-4]+RC[-8]+RC[-12]+RC[-16] -> 0 | Z80: =RC[-3]+RC[-7]+RC[-11]+RC[-15] -> 0
D81: UBSI TIPO III - XXXXXX | K81: =RC[-1] -> 0 | O81: =RC[-1] -> 0 | S81: =RC[-1] -> 0 | W81: =RC[-1] -> 0 | Y81: =RC[-4]+RC[-8]+RC[-12]+RC[-16] -> 0 | Z81: =RC[-3]+RC[-7]+RC[-11]+RC[-15] -> 0
D82: UBSI TIPO III - XXXXXX | K82: =RC[-1] -> 0 | O82: =RC[-1] -> 0 | S82: =RC[-1] -> 0 | W82: =RC[-1] -> 0 | Y82: =RC[-4]+RC[-8]+RC[-12]+RC[-16] -> 0 | Z82: =RC[-3]+RC[-7]+RC[-11]+RC[-15] -> 0
D83: UBSI TIPO III - XXXXXX | K83: =RC[-1] -> 0 | O83: =RC[-1] -> 0 | S83: =RC[-1] -> 0 | W83: =RC[-1] -> 0 | Y83: =RC[-4]+RC[-8]+RC[-12]+RC[-16] -> 0 | Z83: =RC[-3]+RC[-7]+RC[-11]+RC[-15] -> 0
D84: UBSI TIPO III - XXXXXX | K84: =RC[-1] -> 0 | O84: =RC[-1] -> 0 | S84: =RC[-1] -> 0 | W84: =RC[-1] -> 0 | Y84: =RC[-4]+RC[-8]+RC[-12]+RC[-16] -> 0 | Z84: =RC[-3]+RC[-7]+RC[-11]+RC[-15] -> 0 | XDO84: 100000
D85: UBSI TIPO III - XXXXXX | K85: =RC[-1] -> 0 | O85: =RC[-1] -> 0 | S85: =RC[-1] -> 0 | W85: =RC[-1] -> 0 | Y85: =RC[-4]+RC[-8]+RC[-12]+RC[-16] -> 0 | Z85: =RC[-3]+RC[-7]+RC[-11]+RC[-15] -> 0
D86: UBSI TIPO III - XXXXXX | K86: =RC[-1] -> 0 | O86: =RC[-1] -> 0 | S86: =RC[-1] -> 0 | W86: =RC[-1] -> 0 | Y86: =RC[-4]+RC[-8]+RC[-12]+RC[-16] -> 0 | Z86: =RC[-3]+RC[-7]+RC[-11]+RC[-15] -> 0
D87: UBSI TIPO III - XXXXXX | K87: =RC[-1] -> 0 | O87: =RC[-1] -> 0 | S87: =RC[-1] -> 0 | W87: =RC[-1] -> 0 | Y87: =RC[-4]+RC[-8]+RC[-12]+RC[-16] -> 0 | Z87: =RC[-3]+RC[-7]+RC[-11]+RC[-15] -> 0
D88: UBSI TIPO III - XXXXXX | K88: =RC[-1] -> 0 | O88: =RC[-1] -> 0 | S88: =RC[-1] -> 0 | W88: =RC[-1] -> 0 | Y88: =RC[-4]+RC[-8]+RC[-12]+RC[-16] -> 0 | Z88: =RC[-3]+RC[-7]+RC[-11]+RC[-15] -> 0
D89: UBSI TIPO III - XXXXXX | K89: =RC[-1] -> 0 | O89: =RC[-1] -> 0 | S89: =RC[-1] -> 0 | W89: =RC[-1] -> 0 | Y89: =RC[-4]+RC[-8]+RC[-12]+RC[-16] -> 0 | Z89: =RC[-3]+RC[-7]+RC[-11]+RC[-15] -> 0 | XDO89: 100000
D90: UBSI TIPO III - XXXXXX | K90: =RC[-1] -> 0 | O90: =RC[-1] -> 0 | S90: =RC[-1] -> 0 | W90: =RC[-1] -> 0 | Y90: =RC[-4]+RC[-8]+RC[-12]+RC[-16] -> 0 | Z90: =RC[-3]+RC[-7]+RC[-11]+RC[-15] -> 0
D91: UBSI TIPO III - XXXXXX | K91: =RC[-1] -> 0 | O91: =RC[-1] -> 0 | S91: =RC[-1] -> 0 | W91: =RC[-1] -> 0 | Y91: =RC[-4]+RC[-8]+RC[-12]+RC[-16] -> 0 | Z91: =RC[-3]+RC[-7]+RC[-11]+RC[-15] -> 0
D92: UBSI TIPO III - XXXXXX | K92: =RC[-1] -> 0 | O92: =RC[-1] -> 0 | S92: =RC[-1] -> 0 | W92: =RC[-1] -> 0 | Y92: =RC[-4]+RC[-8]+RC[-12]+RC[-16] -> 0 | Z92: =RC[-3]+RC[-7]+RC[-11]+RC[-15] -> 0
D93: UBSI TIPO III - XXXXXX | K93: =RC[-1] -> 0 | O93: =RC[-1] -> 0 | S93: =RC[-1] -> 0 | W93: =RC[-1] -> 0 | Y93: =RC[-4]+RC[-8]+RC[-12]+RC[-16] -> 0 | Z93: =RC[-3]+RC[-7]+RC[-11]+RC[-15] -> 0
D94: UBSI TIPO III - XXXXXX | K94: =RC[-1] -> 0 | O94: =RC[-1] -> 0 | S94: =RC[-1] -> 0 | W94: =RC[-1] -> 0 | Y94: =RC[-4]+RC[-8]+RC[-12]+RC[-16] -> 0 | Z94: =RC[-3]+RC[-7]+RC[-11]+RC[-15] -> 0 | XDO94: 100000
D95: UBSI TIPO III - XXXXXX | K95: =RC[-1] -> 0 | O95: =RC[-1] -> 0 | S95: =RC[-1] -> 0 | W95: =RC[-1] -> 0 | Y95: =RC[-4]+RC[-8]+RC[-12]+RC[-16] -> 0 | Z95: =RC[-3]+RC[-7]+RC[-11]+RC[-15] -> 0
D96: UBSI TIPO III - XXXXXX | K96: =RC[-1] -> 0 | O96: =RC[-1] -> 0 | S96: =RC[-1] -> 0 | W96: =RC[-1] -> 0 | Y96: =RC[-4]+RC[-8]+RC[-12]+RC[-16] -> 0 | Z96: =RC[-3]+RC[-7]+RC[-11]+RC[-15] -> 0
D97: UBSI TIPO III - XXXXXX | K97: =RC[-1] -> 0 | O97: =RC[-1] -> 0 | S97: =RC[-1] -> 0 | W97: =RC[-1] -> 0 | Y97: =RC[-4]+RC[-8]+RC[-12]+RC[-16] -> 0 | Z97: =RC[-3]+RC[-7]+RC[-11]+RC[-15] -> 0
D98: SEDE DO NÚCLEO DISTRITAL DA SESAI | I98: =SUM(R[1]C) -> 0 | K98: =SUM(R[1]C) -> 0 | M98: =SUM(R[1]C) -> 0 | O98: =SUM(R[1]C) -> 0 | Q98: =SUM(R[1]C) -> 0 | S98: =SUM(R[1]C) -> 0 | U98: =SUM(R[1]C) -> 0 | W98: =SUM(R[1]C) -> 0 | Y98: =R[1]C -> 0 | Z98: =R[1]C -> 0
D99: Aquisição do imóvel XYZ | K99: =RC[-1] -> 0 | O99: =RC[-1] -> 0 | S99: =RC[-1] -> 0 | W99: =RC[-1] -> 0 | Y99: =RC[-4]+RC[-8]+RC[-12]+RC[-16] -> 0 | Z99: =RC[-3]+RC[-7]+RC[-11]+RC[-15] -> 0
D100: PÓLO BASE | I100: =SUM(R[1]C:R[14]C) -> 0 | K100: =SUM(R[1]C:R[15]C) -> 0 | M100: =SUM(R[1]C:R[14]C) -> 0 | O100: =SUM(R[1]C:R[15]C) -> 0 | Q100: =SUM(R[1]C:R[14]C) -> 0 | S100: =SUM(R[1]C:R[15]C) -> 0 | U100: =SUM(R[1]C:R[14]C) -> 0 | W100: =SUM(R[1]C:R[15]C) -> 0 | Y100: =RC[-4]+RC[-8]+RC[-12]+RC[-16] -> 0 | Z100: =RC[-3]+RC[-7]+RC[-11]+RC[-15] -> 0
D101: PÓLO BASE A | K101: =RC[-1] -> 0 | O101: =RC[-1] -> 0 | S101: =RC[-1] -> 0 | W101: =RC[-1] -> 0 | Y101: =RC[-4]+RC[-8]+RC[-12]+RC[-16] -> 0 | Z101: =RC[-3]+RC[-7]+RC[-11]+RC[-15] -> 0
D102: PÓLO BASE B | K102: =RC[-1] -> 0 | O102: =RC[-1] -> 0 | S102: =RC[-1] -> 0 | W102: =RC[-1] -> 0 | Y102: =RC[-4]+RC[-8]+RC[-12]+RC[-16] -> 0 | Z102: =RC[-3]+RC[-7]+RC[-11]+RC[-15] -> 0 | XDO102: 100000
D103: PÓLO BASE C | K103: =RC[-1] -> 0 | O103: =RC[-1] -> 0 | S103: =RC[-1] -> 0 | W103: =RC[-1] -> 0 | Y103: =RC[-4]+RC[-8]+RC[-12]+RC[-16] -> 0 | Z103: =RC[-3]+RC[-7]+RC[-11]+RC[-15] -> 0
D104: PÓLO BASE XX | K104: =RC[-1] -> 0 | O104: =RC[-1] -> 0 | S104: =RC[-1] -> 0 | W104: =RC[-1] -> 0 | Y104: =RC[-4]+RC[-8]+RC[-12]+RC[-16] -> 0 | Z104: =RC[-3]+RC[-7]+RC[-11]+RC[-15] -> 0
D105: PÓLO BASE XX | K105: =RC[-1] -> 0 | O105: =RC[-1] -> 0 | S105: =RC[-1] -> 0 | W105: =RC[-1] -> 0 | Y105: =RC[-4]+RC[-8]+RC[-12]+RC[-16] -> 0 | Z105: =RC[-3]+RC[-7]+RC[-11]+RC[-15] -> 0
D106: PÓLO BASE XX | K106: =RC[-1] -> 0 | O106: =RC[-1] -> 0 | S106: =RC[-1] -> 0 | W106: =RC[-1] -> 0 | Y106: =RC[-4]+RC[-8]+RC[-12]+RC[-16] -> 0 | Z106: =RC[-3]+RC[-7]+RC[-11]+RC[-15] -> 0
D107: PÓLO BASE XX | K107: =RC[-1] -> 0 | O107: =RC[-1] -> 0 | S107: =RC[-1] -> 0 | W107: =RC[-1] -> 0 | Y107: =RC[-4]+RC[-8]+RC[-12]+RC[-16] -> 0 | Z107: =RC[-3]+RC[-7]+RC[-11]+RC[-15] -> 0 | XDO107: 100000
D108: PÓLO BASE XX | K108: =RC[-1] -> 0 | O108: =RC[-1] -> 0 | S108: =RC[-1] -> 0 | W108: =RC[-1] -> 0 | Y108: =RC[-4]+RC[-8]+RC[-12]+RC[-16] -> 0 | Z108: =RC[-3]+RC[-7]+RC[-11]+RC[-15] -> 0
D109: PÓLO BASE XX | K109: =RC[-1] -> 0 | O109: =RC[-1] -> 0 | S109: =RC[-1] -> 0 | W109: =RC[-1] -> 0 | Y109: =RC[-4]+RC[-8]+RC[-12]+RC[-16] -> 0 | Z109: =RC[-3]+RC[-7]+RC[-11]+RC[-15] -> 0
D110: PÓLO BASE XX | K110: =RC[-1] -> 0 | O110: =RC[-1] -> 0 | S110: =RC[-1] -> 0 | W110: =RC[-1] -> 0 | Y110: =RC[-4]+RC[-8]+RC[-12]+RC[-16] -> 0 | Z110: =RC[-3]+RC[-7]+RC[-11]+RC[-15] -> 0
D111: PÓLO BASE XX | K111: =RC[-1] -> 0 | O111: =RC[-1] -> 0 | S111: =RC[-1] -> 0 | W111: =RC[-1] -> 0 | Y111: =RC[-4]+RC[-8]+RC[-12]+RC[-16] -> 0 | Z111: =RC[-3]+RC[-7]+RC[-11]+RC[-15] -> 0
D112: PÓLO BASE XX | K112: =RC[-1] -> 0 | O112: =RC[-1] -> 0 | S112: =RC[-1] -> 0 | W112: =RC[-1] -> 0 | Y112: =RC[-4]+RC[-8]+RC[-12]+RC[-16] -> 0 | Z112: =RC[-3]+RC[-7]+RC[-11]+RC[-15] -> 0 | XDO112: 100000
D113: PÓLO BASE XX | K113: =RC[-1] -> 0 | O113: =RC[-1] -> 0 | S113: =RC[-1] -> 0 | W113: =RC[-1] -> 0 | Y113: =RC[-4]+RC[-8]+RC[-12]+RC[-16] -> 0 | Z113: =RC[-3]+RC[-7]+RC[-11]+RC[-15] -> 0
D114: PÓLO BASE XX | K114: =RC[-1] -> 0 | O114: =RC[-1] -> 0 | S114: =RC[-1] -> 0 | W114: =RC[-1] -> 0 | Y114: =RC[-4]+RC[-8]+RC[-12]+RC[-16] -> 0 | Z114: =RC[-3]+RC[-7]+RC[-11]+RC[-15] -> 0
D115: PÓLO BASE XX | K115: =RC[-1] -> 0 | O115: =RC[-1] -> 0 | S115: =RC[-1] -> 0 | W115: =RC[-1] -> 0 | Y115: =RC[-4]+RC[-8]+RC[-12]+RC[-16] -> 0 | Z115: =RC[-3]+RC[-7]+RC[-11]+RC[-15] -> 0
D116: REFORMAS | I116: =SUM(R[1]C:R[21]C) -> 0 | K116: =SUM(R[1]C:R[21]C) -> 0 | M116: =SUM(R[1]C:R[21]C) -> 0 | O116: =SUM(R[1]C:R[21]C) -> 0 | Q116: =SUM(R[1]C:R[21]C) -> 0 | S116: =SUM(R[1]C:R[21]C) -> 0 | U116: =SUM(R[1]C:R[21]C) -> 0 | W116: =SUM(R[1]C:R[21]C) -> 0 | Y116: =RC[-4]+RC[-8]+RC[-12]+RC[-16] -> 0 | Z116: =RC[-3]+RC[-7]+RC[-11]+RC[-15] -> 0
K117: =RC[-1] -> 0 | O117: =RC[-1] -> 0 | S117: =RC[-1] -> 0 | W117: =RC[-1] -> 0 | Y117: =RC[-4]+RC[-8]+RC[-12]+RC[-16] -> 0 | Z117: =RC[-3]+RC[-7]+RC[-11]+RC[-15] -> 0
K118: =RC[-1] -> 0 | O118: =RC[-1] -> 0 | S118: =RC[-1] -> 0 | W118: =RC[-1] -> 0 | Y118: =RC[-4]+RC[-8]+RC[-12]+RC[-16] -> 0 | Z118: =RC[-3]+RC[-7]+RC[-11]+RC[-15] -> 0 | XDO118: 100000
K119: =RC[-1] -> 0 | O119: =RC[-1] -> 0 | S119: =RC[-1] -> 0 | W119: =RC[-1] -> 0 | Y119: =RC[-4]+RC[-8]+RC[-12]+RC[-16] -> 0 | Z119: =RC[-3]+RC[-7]+RC[-11]+RC[-15] -> 0
K120: =RC[-1] -> 0 | O120: =RC[-1] -> 0 | S120: =RC[-1] -> 0 | W120: =RC[-1] -> 0 | Y120: =RC[-4]+RC[-8]+RC[-12]+RC[-16] -> 0 | Z120: =RC[-3]+RC[-7]+RC[-11]+RC[-15] -> 0
K121: =RC[-1] -> 0 | O121: =RC[-1] -> 0 | S121: =RC[-1] -> 0 | W121: =RC[-1] -> 0 | Y121: =RC[-4]+RC[-8]+RC[-12]+RC[-16] -> 0 | Z121: =RC[-3]+RC[-7]+RC[-11]+RC[-15] -> 0
K122: =RC[-1] -> 0 | O122: =RC[-1] -> 0 | S122: =RC[-1] -> 0 | W122: =RC[-1] -> 0 | Y122: =RC[-4]+RC[-8]+RC[-12]+RC[-16] -> 0 | Z122: =RC[-3]+RC[-7]+RC[-11]+RC[-15] -> 0
K123: =RC[-1] -> 0 | O123: =RC[-1] -> 0 | S123: =RC[-1] -> 0 | W123: =RC[-1] -> 0 | Y123: =RC[-4]+RC[-8]+RC[-12]+RC[-16] -> 0 | Z123: =RC[-3]+RC[-7]+RC[-11]+RC[-15] -> 0 | XDO123: 100000
K124: =RC[-1] -> 0 | O124: =RC[-1] -> 0 | S124: =RC[-1] -> 0 | W124: =RC[-1] -> 0 | Y124: =RC[-4]+RC[-8]+RC[-12]+RC[-16] -> 0 | Z124: =RC[-3]+RC[-7]+RC[-11]+RC[-15] -> 0
K125: =RC[-1] -> 0 | O125: =RC[-1] -> 0 | S125: =RC[-1] -> 0 | W125: =RC[-1] -> 0 | Y125: =RC[-4]+RC[-8]+RC[-12]+RC[-16] -> 0 | Z125: =RC[-3]+RC[-7]+RC[-11]+RC[-15] -> 0
K126: =RC[-1] -> 0 | O126: =RC[-1] -> 0 | S126: =RC[-1] -> 0 | W126: =RC[-1] -> 0 | Y126: =RC[-4]+RC[-8]+RC[-12]+RC[-16] -> 0 | Z126: =RC[-3]+RC[-7]+RC[-11]+RC[-15] -> 0
K127: =RC[-1] -> 0 | O127: =RC[-1] -> 0 | S127: =RC[-1] -> 0 | W127: =RC[-1] -> 0 | Y127: =RC[-4]+RC[-8]+RC[-12]+RC[-16] -> 0 | Z127: =RC[-3]+RC[-7]+RC[-11]+RC[-15] -> 0
K128: =RC[-1] -> 0 | O128: =RC[-1] -> 0 | S128: =RC[-1] -> 0 | W128: =RC[-1] -> 0 | Y128: =RC[-4]+RC[-8]+RC[-12]+RC[-16] -> 0 | Z128: =RC[-3]+RC[-7]+RC[-11]+RC[-15] -> 0 | XDO128: 100000
K129: =RC[-1] -> 0 | O129: =RC[-1] -> 0 | S129: =RC[-1] -> 0 | W129: =RC[-1] -> 0 | Y129: =RC[-4]+RC[-8]+RC[-12]+RC[-16] -> 0 | Z129: =RC[-3]+RC[-7]+RC[-11]+RC[-15] -> 0
K130: =RC[-1] -> 0 | O130: =RC[-1] -> 0 | S130: =RC[-1] -> 0 | W130: =RC[-1] -> 0 | Y130: =RC[-4]+RC[-8]+RC[-12]+RC[-16] -> 0 | Z130: =RC[-3]+RC[-7]+RC[-11]+RC[-15] -> 0
K131: =RC[-1] -> 0 | O131: =RC[-1] -> 0 | S131: =RC[-1] -> 0 | W131: =RC[-1] -> 0 | Y131: =RC[-4]+RC[-8]+RC[-12]+RC[-16] -> 0 | Z131: =RC[-3]+RC[-7]+RC[-11]+RC[-15] -> 0
K132: =RC[-1] -> 0 | O132: =RC[-1] -> 0 | S132: =RC[-1] -> 0 | W132: =RC[-1] -> 0 | Y132: =RC[-4]+RC[-8]+RC[-12]+RC[-16] -> 0 | Z132: =RC[-3]+RC[-7]+RC[-11]+RC[-15] -> 0
K133: =RC[-1] -> 0 | O133: =RC[-1] -> 0 | S133: =RC[-1] -> 0 | W133: =RC[-1] -> 0 | Y133: =RC[-4]+RC[-8]+RC[-12]+RC[-16] -> 0 | Z133: =RC[-3]+RC[-7]+RC[-11]+RC[-15] -> 0
K134: =RC[-1] -> 0 | O134: =RC[-1] -> 0 | S134: =RC[-1] -> 0 | W134: =RC[-1] -> 0 | Y134: =RC[-4]+RC[-8]+RC[-12]+RC[-16] -> 0 | Z134: =RC[-3]+RC[-7]+RC[-11]+RC[-15] -> 0 | XDO134: 100000
K135: =RC[-1] -> 0 | O135: =RC[-1] -> 0 | S135: =RC[-1] -> 0 | W135: =RC[-1] -> 0 | Y135: =RC[-4]+RC[-8]+RC[-12]+RC[-16] -> 0 | Z135: =RC[-3]+RC[-7]+RC[-11]+RC[-15] -> 0
K136: =RC[-1] -> 0 | O136: =RC[-1] -> 0 | S136: =RC[-1] -> 0 | W136: =RC[-1] -> 0 | Y136: =RC[-4]+RC[-8]+RC[-12]+RC[-16] -> 0 | Z136: =RC[-3]+RC[-7]+RC[-11]+RC[-15] -> 0
K137: =RC[-1] -> 0 | O137: =RC[-1] -> 0 | S137: =RC[-1] -> 0 | W137: =RC[-1] -> 0 | Y137: =RC[-4]+RC[-8]+RC[-12]+RC[-16] -> 0 | Z137: =RC[-3]+RC[-7]+RC[-11]+RC[-15] -> 0
D139: TOTAL EDIFICAÇÕES | K139: =R[-130]C+R[-114]C+R[-83]C+R[-62]C+R[-41]C+R[-39]C+R[-23]C -> 718000 | O139: =R[-130]C+R[-114]C+R[-83]C+R[-62]C+R[-41]C+R[-39]C+R[-23]C -> 3600000 | S139: =R[-130]C+R[-114]C+R[-83]C+R[-62]C+R[-41]C+R[-39]C+R[-23]C -> 2800000 | W139: =R[-130]C+R[-114]C+R[-83]C+R[-62]C+R[-41]C+R[-39]C+R[-23]C -> 3000000 | Z139: =RC[-3]+RC[-7]+RC[-11]+RC[-15] -> 10118000
B141: 4.4.90.51.91 | C141: OBRAS DE SANEAMENTO
D142: SISTEMA DE ABASTECIMENTO DE ÁGUA (SAA) | K142: =RC[-2]*RC[-1] -> 0 | M142: 6 | N142: 1500000 | O142: =RC[-2]*RC[-1] -> 9000000 | Q142: 3 | R142: 1500000 | S142: =RC[-2]*RC[-1] -> 4500000 | U142: 3 | V142: 1500000 | W142: =RC[-2]*RC[-1] -> 4500000 | Z142: =RC[-3]+RC[-7]+RC[-11]+RC[-15] -> 18000000
D143: MELHORIAS SANITÁRIAS DOMICILIARES (MSD) | I143: 6 | J143: 24993 | K143: =RC[-2]*RC[-1] -> 149958 | M143: 30 | N143: 16000 | O143: =RC[-2]*RC[-1] -> 480000 | Q143: 30 | R143: 17500 | S143: =RC[-2]*RC[-1] -> 525000 | U143: 30 | V143: 19000 | W143: =RC[-2]*RC[-1] -> 570000 | Z143: =RC[-3]+RC[-7]+RC[-11]+RC[-15] -> 1724958
D144: ESGOTAMENTO SANITÁRIO | K144: =RC[-2]*RC[-1] -> 0 | O144: =RC[-2]*RC[-1] -> 0 | S144: =RC[-2]*RC[-1] -> 0 | W144: =RC[-2]*RC[-1] -> 0 | Z144: =RC[-3]+RC[-7]+RC[-11]+RC[-15] -> 0
D145: REFORMAS/ AMPLIAÇÃO | Z145: =RC[-3]+RC[-7]+RC[-11]+RC[-15] -> 0
D147: TOTAL OBRAS DE SANEAMENTO | K147: =SUM(R[-5]C:R[-2]C) -> 149958 | O147: =SUM(R[-5]C:R[-2]C) -> 9480000 | S147: =SUM(R[-5]C:R[-2]C) -> 5025000 | W147: =SUM(R[-5]C:R[-2]C) -> 5070000 | Z147: =RC[-3]+RC[-7]+RC[-11]+RC[-15] -> 19724958