Sheet: síntese previsão PDSI
B2: SESAI :: PLANO DISTRITAL DE SAÚDE INDÍGENA 2016-2019
B3: PREVISÃO ORÇAMENTÁRIA PDSI 2016-2019*
B4: =Investimento!RC[1] -> DSEI INTERIOR SUL
G5: =#REF! -> #REF! | H5: =#REF! -> #REF! | I5: =#REF! -> #REF!
B7: DESPESA | D7: PREVISÃO ORÇAMENTÁRIA DE REFRÊNCIA 2015 (em R$) | F7: PREVISÃO ORÇAMENTÁRIA DE REFRÊNCIA 2016 (em R$) | G7: PREVISÃO ORÇAMENTÁRIA DE REFRÊNCIA 2017 (em R$) | H7: PREVISÃO ORÇAMENTÁRIA DE REFRÊNCIA 2018 (em R$) | I7: PREVISÃO ORÇAMENTÁRIA DE REFRÊNCIA 2019 (em R$) | J7: PREVISÃO ORÇAMENTÁRIA DE REFRÊNCIA DOS 4 ANOS (2016-2019) (em R$)
B8: CUSTEIO | D8: =#REF! -> #REF! | F8: =SUM(R[1]C:R[10]C) -> 69227718.415198207 | G8: =SUM(R[1]C:R[10]C) -> 70394888.975086585 | H8: =SUM(R[1]C:R[10]C) -> 71791356.57438831 | I8: =SUM(R[1]C:R[10]C) -> 73571852.763498008 | J8: =SUM(RC[-4]:RC[-1]) -> 284985816.72817111
B9: MATERIAL MÉDICO HOSPITALAR (MMH) | D9: =#REF! -> #REF! | F9: =Custeio!R[-1]C[-1] -> 640468.86916743603 | G9: =Custeio!R[-1]C[2] -> 651356.83994328242 | H9: =Custeio!R[-1]C[5] -> 664383.97674214805 | I9: =Custeio!R[-1]C[8] -> 680993.57616070169 | J9: =SUM(RC[-4]:RC[-1]) -> 2637203.2620135685
B10: CUSTEIO DE SANEAMENTO | D10: =#REF! -> #REF! | F10: =Custeio!R[-1]C[-1] -> 2941522.4 | G10: =Custeio!R[-1]C[2] -> 2991528.2807999998 | H10: =Custeio!R[-1]C[5] -> 3051358.8464159998 | I10: =Custeio!R[-1]C[8] -> 3127642.8175763995 | J10: =SUM(RC[-4]:RC[-1]) -> 12112052.3447924
B11: CUSTEIO DE EDIFICAÇÕES | D11: =#REF! -> #REF! | F11: =Custeio!R[-1]C -> 0 | G11: =Custeio!R[-1]C[3] -> 0 | H11: =Custeio!R[-1]C[6] -> 0 | I11: =Custeio!R[-1]C[9] -> 0 | J11: =SUM(RC[-4]:RC[-1]) -> 0
B12: SATELITAL | D12: =#REF! -> #REF! | F12: =Custeio!R[-1]C[-1] -> 0 | G12: =Custeio!R[-1]C[2] -> 0 | H12: =Custeio!R[-1]C[5] -> 0 | I12: =Custeio!R[-1]C[8] -> 0 | J12: =SUM(RC[-4]:RC[-1]) -> 0
B13: PASSAGENS E DIÁRIAS (SCDP + Contratos de Passagens) | D13: =#REF! -> #REF! | F13: =Custeio!R[-1]C[-1] -> 474600 | G13: =Custeio!R[-1]C[2] -> 482668.19999999995 | H13: =Custeio!R[-1]C[5] -> 492321.56399999995 | I13: =Custeio!R[-1]C[8] -> 504629.60309999989 | J13: =SUM(RC[-4]:RC[-1]) -> 1954219.3670999999
B14: CONVÊNIOS PARA CONTRATAÇÃO DE RECURSOS HUMANOS | D14: =#REF! -> #REF! | F14: =Custeio!R[-1]C[-1] -> 42565139.423806965 | G14: =Custeio!R[-1]C[2] -> 43288746.794011682 | H14: =Custeio!R[-1]C[5] -> 44154521.729891919 | I14: =Custeio!R[-1]C[8] -> 45258384.773139216 | J14: =SUM(RC[-4]:RC[-1]) -> 175266792.72084978
B15: MEDICAMENTOS | D15: =#REF! -> #REF! | F15: =Custeio!R[-1]C[-1] -> 1131933.7122238115 | G15: =Custeio!R[-1]C[2] -> 1151176.5853316162 | H15: =Custeio!R[-1]C[5] -> 1174200.1170382486 | I15: =Custeio!R[-1]C[8] -> 1203555.1199642047 | J15: =SUM(RC[-4]:RC[-1]) -> 4660865.5345578808
B16: SERVIDORES PÚBLICO FEDERAIS (CTU/EFETIVO/CEDIDOS) | D16: =#REF! -> #REF! | F16: =Custeio!R[-1]C[-1] -> 571509.01 | G16: =Custeio!R[-1]C[2] -> 571509.01 | H16: =Custeio!R[-1]C[5] -> 571509.01 | I16: =Custeio!R[-1]C[8] -> 571509.01 | J16: =SUM(RC[-4]:RC[-1]) -> 2286036.04
B17: COMBUSTÍVEL | D17: =#REF! -> #REF! | F17: =Custeio!R[-1]C[-1] -> 1897245 | G17: =Custeio!R[-1]C[2] -> 1929498.1649999998 | H17: =Custeio!R[-1]C[5] -> 1968088.1282999997 | I17: =Custeio!R[-1]C[8] -> 2017290.3315074996 | J17: =SUM(RC[-4]:RC[-1]) -> 7812121.6248074993
B18: CONTRATOS | D18: =#REF! -> #REF! | F18: =Custeio!R[-1]C -> 19005300 | G18: =Custeio!R[-1]C[3] -> 19328405.100000001 | H18: =Custeio!R[-1]C[6] -> 19714973.202 | I18: =Custeio!R[-1]C[9] -> 20207847.532049999 | J18: =SUM(RC[-4]:RC[-1]) -> 78256525.83405
C19: ALIMENTAÇÃO | D19: =#REF! -> #REF! | F19: =Custeio!R[-1]C -> 180000 | G19: =Custeio!R[-1]C[3] -> 183059.99999999997 | H19: =Custeio!R[-1]C[6] -> 186721.19999999998 | I19: =Custeio!R[-1]C[9] -> 191389.22999999995 | J19: =SUM(RC[-4]:RC[-1]) -> 741170.42999999993
C20: HORAS VÔO | D20: =#REF! -> #REF! | F20: =Custeio!R[2]C -> 0 | G20: =Custeio!R[2]C[3] -> 0 | H20: =Custeio!R[2]C[6] -> 0 | I20: =Custeio!R[2]C[9] -> 0 | J20: =SUM(RC[-4]:RC[-1]) -> 0
C21: LOCAÇÃO DE VEÍCULOS | D21: =#REF! -> #REF! | F21: =Custeio!R[3]C -> 0 | G21: =Custeio!R[3]C[3] -> 0 | H21: =Custeio!R[3]C[6] -> 0 | I21: =Custeio!R[3]C[9] -> 0 | J21: =SUM(RC[-4]:RC[-1]) -> 0
C22: LOCAÇÃO DE MÃO DE OBRA | D22: =#REF! -> #REF! | F22: =Custeio!R[6]C -> 11308000 | G22: =Custeio!R[6]C[3] -> 11220561 | H22: =Custeio!R[6]C[6] -> 11444972.220000001 | I22: =Custeio!R[6]C[9] -> 11731096.5255 | J22: =SUM(RC[-4]:RC[-1]) -> 45704629.745499998
C23: OUTROS CONTRATOS | D23: =#REF! -> #REF! | F23: =Custeio!R[14]C -> 7517300 | G23: =Custeio!R[14]C[3] -> 7924784.0999999996 | H23: =Custeio!R[14]C[6] -> 8083279.7819999987 | I23: =Custeio!R[14]C[9] -> 8285361.7765499977 | J23: =SUM(RC[-4]:RC[-1]) -> 31810725.658549998
B25: INVESTIMENTO | F25: =SUM(R[1]C:R[3]C) -> 867958 | G25: =SUM(R[1]C:R[3]C) -> 13080000 | H25: =SUM(R[1]C:R[3]C) -> 7825000 | I25: =SUM(R[1]C:R[3]C) -> 8070000 | J25: =SUM(R[1]C:R[3]C) -> 29842958
B26: =Investimento!R[-18]C[1] -> OBRAS DE EDIFICAÇÕES | F26: =Investimento!R[113]C[5] -> 718000 | G26: =Investimento!R[113]C[8] -> 3600000 | H26: =Investimento!R[113]C[11] -> 2800000 | I26: =Investimento!R[113]C[14] -> 3000000 | J26: =SUM(RC[-4]:RC[-1]) -> 10118000
B27: =Investimento!R[114]C[1] -> OBRAS DE SANEAMENTO | F27: =Investimento!R[120]C[5] -> 149958 | G27: =Investimento!R[120]C[8] -> 9480000 | H27: =Investimento!R[120]C[11] -> 5025000 | I27: =Investimento!R[120]C[14] -> 5070000 | J27: =SUM(RC[-4]:RC[-1]) -> 19724958
B28: EQUIPAMENTOS
B30: TOTAL | D30: =R[-5]C+R[-22]C -> #REF! | F30: =R[-5]C+R[-22]C -> 70095676.415198207 | G30: =R[-5]C+R[-22]C -> 83474888.975086585 | H30: =R[-5]C+R[-22]C -> 79616356.57438831 | I30: =R[-5]C+R[-22]C -> 81641852.763498008 | J30: =R[-5]C+R[-22]C -> 314828774.72817111
B31: * Valores sujeito a alterações.
B34: CUSTEIO SESAI Central | D34: =#REF! -> #REF! | F34: =Custeio!R[64]C[-1] -> 69227733.452198207 | G34: =Custeio!R[64]C[2] -> 70394889.267715573 | H34: =Custeio!R[64]C[5] -> 71791356.872869894 | I34: =Custeio!R[64]C[8] -> 73571853.069441631 | J34: =SUM(RC[-4]:RC[-1]) -> 284985832.66222531
B36: Saldo do Custeio para o DSEI | D36: =#REF! -> #REF! | F36: =R[-2]C-R[-28]C -> 15.037000000476837 | G36: =R[-2]C-R[-28]C -> 0.29262898862361908 | H36: =R[-2]C-R[-28]C -> 0.29848158359527588 | I36: =R[-2]C-R[-28]C -> 0.30594362318515778 | J36: =R[-2]C-R[-28]C -> 15.93405419588089